Introduction	序章
Start New Hero	建立新英雄
Restore Game	讀取進度
Go to Town	前往城鎮
Continue Normally	正常繼續
Where to, Hero?    	英雄,要往哪去?
The software you are now using was produced through the efforts of many people: designers, artists, programmers, musicians, and lots of other hard-working folks.	您現在使用的這套軟體,是由許多人共同努力打造的成果:設計師、美術、程式設計師、音樂家,以及許多辛勤付出的夥伴。
If you make copies of this software for any reason other than to make a personal backup, you are not only breaking the law, but raising the cost of software for all legitimate users.  PLEASE DO NOT MAKE ILLEGAL COPIES OF THIS GAME!  	若你基於個人備份以外的任何理由複製本軟體,不僅觸犯法律,更會推高所有正當使用者的軟體成本。請勿非法複製本遊戲!
Oh, by the way . . .  You will need the information contained in the printed documentation to successfully complete this game.  In other words, it's not just the law . . . It's a good idea. 	對了…你會需要印刷手冊裡的資訊,才能順利完成本遊戲。換句話說,這不只是法律問題…也是個好主意。
10 minute rest	休息 10 分鐘
30 minute rest	休息 30 分鐘
60 minute rest	休息 60 分鐘
Sleep all night 	睡到天亮
Stay awake    	保持清醒
You just can't sleep during the daytime.	你在白天就是睡不著。
You awake as the sun begins to rise.	你在旭日初升時醒來。
How long, Hero? 	要多久呢,英雄?
You're too impatient to rest right now.	你現在太焦躁,靜不下來休息。
After %d minutes rest, you feel better.  	After %d minutes rest, you feel better.  
Your hunger has been totally satisfied.  You don't need another piece of fruit.	Your hunger has been totally satisfied.  You don't need another piece of fruit.
The fruit is very soft and juicy. It would be impossible to keep in your pack.	The fruit is very soft and juicy. It would be impossible to keep in your pack.
The stone has been moved.	The stone has been moved.
The large stone appears to be ancient and deliberately placed.  Marks carved into the stone almost look like writing.	The large stone appears to be ancient and deliberately placed.  Marks carved into the stone almost look like writing.
In a hole, hidden beneath the ancient stone, someone has placed a scroll.	In a hole, hidden beneath the ancient stone, someone has placed a scroll.
You took the scroll.	You took the scroll.
The stone has the words "Erana's Peace" carved upon the top.  There are some runes carved along the side. 	The stone has the words "Erana's Peace" carved upon the top.  There are some runes carved along the side. 
It reads:  "If thy Will is Magic, so shall I share.  Open this Stone and claim what is there."	It reads:  "If thy Will is Magic, so shall I share.  Open this Stone and claim what is there."
The hole that was beneath the stone is empty. 	The hole that was beneath the stone is empty. 
No amount of physical effort will be able to move this stone.	No amount of physical effort will be able to move this stone.
The grasses in the meadow are covered over with flowers.	The grasses in the meadow are covered over with flowers.
All kinds of colorful and fragrant flowers and grasses cover the meadow.	All kinds of colorful and fragrant flowers and grasses cover the meadow.
The meadow is an oasis at the edge of the snowline.  The rocky hillside looks very steep and slippery.	The meadow is an oasis at the edge of the snowline.  The rocky hillside looks very steep and slippery.
You have all the flowers you need.	You have all the flowers you need.
As you pick a variety of the sweet-smelling flowers, they seem to glow in your hands.  You put them safely away.	As you pick a variety of the sweet-smelling flowers, they seem to glow in your hands.  You put them safely away.
You take another handful of the lovely, fragrant flowers.	You take another handful of the lovely, fragrant flowers.
This entire area is magical.  In particular, the fruit on the tree radiates magic, and you sense that a spell has been placed on the large stone.  All of the magic has a warm, nurturing feel to it.	This entire area is magical.  In particular, the fruit on the tree radiates magic, and you sense that a spell has been placed on the large stone.  All of the magic has a warm, nurturing feel to it.
The very air in this meadow radiates feelings of calmness and peace.  You wouldn't be able to tell if the spell worked here.	The very air in this meadow radiates feelings of calmness and peace.  You wouldn't be able to tell if the spell worked here.
You can't imagine hurting anything in this meadow.  	You can't imagine hurting anything in this meadow.  
The sky is clear.	天空晴朗無雲。
The sun feels warm.	陽光暖洋洋的。
The stars shine.	繁星閃爍。
To the north, the high, snowy peaks of the Dragon Smoke mountains are clearly visible.	To the north, the high, snowy peaks of the Dragon Smoke mountains are clearly visible.
You are at the snowline.  All around you, except for the forest, the rocks and mountains glisten with slippery snow.	You are at the snowline.  All around you, except for the forest, the rocks and mountains glisten with slippery snow.
The rock faces are slippery with melted snow.	The rock faces are slippery with melted snow.
You sleep comfortably among the fragrant flowers.	You sleep comfortably among the fragrant flowers.
The sweet, juicy fruit of the tree is amazingly satisfying and refreshing.	The sweet, juicy fruit of the tree is amazingly satisfying and refreshing.
The scroll vanishes even as you read the magical runes upon it.  You now have the knowledge to cast a "Calm" spell. 	The scroll vanishes even as you read the magical runes upon it.  You now have the knowledge to cast a "Calm" spell. 
The meadow lies covered with a blanket of flowers, unusual for this early in the spring.  It is warm, even though surrounded by the late snows of winter. 	The meadow lies covered with a blanket of flowers, unusual for this early in the spring.  It is warm, even though surrounded by the late snows of winter. 
A large, carved stone lies flat on the ground.  You feel as though someone gentle was watching over you.  You feel that you are safe here.   	A large, carved stone lies flat on the ground.  You feel as though someone gentle was watching over you.  You feel that you are safe here.   
The air has the fresh, clean scent of the mountains, accompanied by numerous perfume-like fragrances.    	The air has the fresh, clean scent of the mountains, accompanied by numerous perfume-like fragrances.    
There is an aura of magic throughout this meadow.  It seems to be benevolent and restorative.	There is an aura of magic throughout this meadow.  It seems to be benevolent and restorative.
There is no further purpose in casting the Open spell.	There is no further purpose in casting the Open spell.
The tree's blossoms are soft, green and fragrant.	The tree's blossoms are soft, green and fragrant.
The fruit sparkles in the sunlight, yet it appears soft and fuzzy.	The fruit sparkles in the sunlight, yet it appears soft and fuzzy.
The fruit glows and shimmers in the moonlight.  It produces a fragrance like a sun-ripened strawberry.	The fruit glows and shimmers in the moonlight.  It produces a fragrance like a sun-ripened strawberry.
The small tree is most amazing.  It bears blossoms and fruit at the same time, and the fruit on its boughs seems to shyly appear and disappear, shimmering.	The small tree is most amazing.  It bears blossoms and fruit at the same time, and the fruit on its boughs seems to shyly appear and disappear, shimmering.
There is no need to climb the little tree.	There is no need to climb the little tree.
Thick bushes block your path to the south. 	Thick bushes block your path to the south. 
There is a cave entrance large enough to admit a man.	There is a cave entrance large enough to admit a man.
It's already unlocked.	It's already unlocked.
The chest is already open.	The chest is already open.
You don't have the right tools -- you'll have to find another way to open it.	You don't have the right tools -- you'll have to find another way to open it.
It's locked -- you'll have to use another skill to open this.	It's locked -- you'll have to use another skill to open this.
The dead Ogre's chest lies open, its contents glittering brightly.	The dead Ogre's chest lies open, its contents glittering brightly.
The dead Ogre's chest lies open and empty.	The dead Ogre's chest lies open and empty.
How much more calm can he get?	How much more calm can he get?
You've wasted a spell.	You've wasted a spell.
You don't have a knife.	You don't have a knife.
The Ogre is already dead.  It would do no good to kill him again. 	The Ogre is already dead.  It would do no good to kill him again. 
Ok, he'll be a dazzled cadaver.	Ok, he'll be a dazzled cadaver.
You're kidding, right?	You're kidding, right?
There is a dead Ogre here.	There is a dead Ogre here.
The chest has a heavy lid with a strong lock.	The chest has a heavy lid with a strong lock.
The Ogre is carrying a chest in his massive arms.	The Ogre is carrying a chest in his massive arms.
This Ogre is in a bad mood.	This Ogre is in a bad mood.
And big.  Very BIG. 	And big.  Very BIG. 
There is a big, ugly, dead Ogre here.	There is a big, ugly, dead Ogre here.
This Ogre will never eat again.	This Ogre will never eat again.
This Ogre looks like it would rather eat you.	This Ogre looks like it would rather eat you.
Hostile intent is evident.  You prepare for battle.	Hostile intent is evident.  You prepare for battle.
You need to get closer to the dead Ogre.	You need to get closer to the dead Ogre.
There is nothing here to open.	There is nothing here to open.
The dead Ogre's chest is empty.	The dead Ogre's chest is empty.
The dead Ogre's chest contains 1 gold and 43 silver, which you take and put away.	The dead Ogre's chest contains 1 gold and 43 silver, which you take and put away.
The Ogre is dazzled by your spell. 	The Ogre is dazzled by your spell. 
A search of the dead Ogre's body produces no treasure.	A search of the dead Ogre's body produces no treasure.
However, the treasure chest he was carrying lies beside his body.	However, the treasure chest he was carrying lies beside his body.
The dead Ogre's huge club is much too heavy for you to lift.	The dead Ogre's huge club is much too heavy for you to lift.
You force the Ogre's chest open.	You force the Ogre's chest open.
The chest is locked.	The chest is locked.
Your spell is too weak to open the Ogre's chest.	Your spell is too weak to open the Ogre's chest.
You're wasting a spell.	You're wasting a spell.
There's nothing here to open.	There's nothing here to open.
The chest is held shut by the Ogre's massive arms.	The chest is held shut by the Ogre's massive arms.
standing	standing
Your spell unlocks the Ogre's chest.	Your spell unlocks the Ogre's chest.
The Ogre appears to have recovered from your spell.	The Ogre appears to have recovered from your spell.
You retrieve your daggers.	You retrieve your daggers.
The Ogre's chest is already unlocked.	The Ogre's chest is already unlocked.
The lock on the Ogre's chest clicks open.  The dead Ogre's chest contains 1 gold and 43 silver, which you take and put away.  	The lock on the Ogre's chest clicks open.  The dead Ogre's chest contains 1 gold and 43 silver, which you take and put away.  
A magical aura emanates from the cave's entrance.	A magical aura emanates from the cave's entrance.
You want to fetch THAT?	You want to fetch THAT?
I don't know what you want to fetch. 	I don't know what you want to fetch. 
The ground shows the beginning of new spring grass. 	The ground shows the beginning of new spring grass. 
Don't open the Ogre -- it's all gucky and squishy inside.	Don't open the Ogre -- it's all gucky and squishy inside.
You don't seem to have a weapon to charge.	You don't seem to have a weapon to charge.
Your weapon is now magically charged.	Your weapon is now magically charged.
The rocks look like they've been dropped in place by a gigantic hand.  	The rocks look like they've been dropped in place by a gigantic hand.  
You see some of the trees of the forest. 	You see some of the trees of the forest. 
You'd better not.  The bear isn't wearing a flea collar (just a locked chain).	You'd better not.  The bear isn't wearing a flea collar (just a locked chain).
The bear seems to find your flowers tasty, but not very filling.	The bear seems to find your flowers tasty, but not very filling.
The Bear won't let you near the lock.	The Bear won't let you near the lock.
Try as you might, you can't pick the lock.  It must be magical.	Try as you might, you can't pick the lock.  It must be magical.
Although looking somewhat scorched, the bear is still very dangerous.	Although looking somewhat scorched, the bear is still very dangerous.
Stunned, the bear is temporarily frozen.	Stunned, the bear is temporarily frozen.
On one side of this cavern is a creature which looks like a large bear.  There is something attached to his leg.	On one side of this cavern is a creature which looks like a large bear.  There is something attached to his leg.
The bear appears docile for the time being.	The bear appears docile for the time being.
The bear looks menacing and angry.  There is a locked chain attached to its leg.	The bear looks menacing and angry.  There is a locked chain attached to its leg.
You have made this bear very happy; it would be wise to take advantage of his current mood. 	You have made this bear very happy; it would be wise to take advantage of his current mood. 
You know that bears can't talk!	You know that bears can't talk!
Hi there!  I represent Ditto Realty.  We have some LOVELY properties that are PROVEN bargains.  We know that's true, because we've sold them so many times.	Hi there!  I represent Ditto Realty.  We have some LOVELY properties that are PROVEN bargains.  We know that's true, because we've sold them so many times.
Beyond the bear, the cave seems to continue.  The bear blocks the way.	Beyond the bear, the cave seems to continue.  The bear blocks the way.
An eerie luminescence emanates from a chamber deeper within the cave.	An eerie luminescence emanates from a chamber deeper within the cave.
A very large bear rears up as you approach.  It looks hungry and dangerous.	A very large bear rears up as you approach.  It looks hungry and dangerous.
As your eyes adjust from sunlight to darkness, you examine the interior of this eerie cavern.  You sense something moving off to your right.	As your eyes adjust from sunlight to darkness, you examine the interior of this eerie cavern.  You sense something moving off to your right.
The Kobold's key disappears as you turn it in the lock.	The Kobold's key disappears as you turn it in the lock.
There is no magic in the cave.	There is no magic in the cave.
There is an aura of magic throughout the cavern.  It seems to center on the bear	There is an aura of magic throughout the cavern.  It seems to center on the bear
Once your eyes get adjusted to the dark, there's still nothing to see in here.	Once your eyes get adjusted to the dark, there's still nothing to see in here.
What could you possibly do with a stalagmite... or is it a stalactite?	What could you possibly do with a stalagmite... or is it a stalactite?
The stalagmites grow slowly... or are they stalactites?	The stalagmites grow slowly... or are they stalactites?
What could you possibly do with a stalactite... or is it a stalagmite?	What could you possibly do with a stalactite... or is it a stalagmite?
The stalactites grow slowly... or are they stalagmites?	The stalactites grow slowly... or are they stalagmites?
The Kobold doesn't look very calm.  In fact, it looks totally unaffected by your spell.	The Kobold doesn't look very calm.  In fact, it looks totally unaffected by your spell.
You just bumped into something on the floor.  It feels like a large wooden chest, but you don't see anything there.	You just bumped into something on the floor.  It feels like a large wooden chest, but you don't see anything there.
You will have to open it first.  The chest seems to be locked.	You will have to open it first.  The chest seems to be locked.
You've already taken the treasure.	You've already taken the treasure.
You are too far away to get the Kobold's treasure.	You are too far away to get the Kobold's treasure.
The key doesn't fit in the chest.  It must be for a different lock.	The key doesn't fit in the chest.  It must be for a different lock.
You have no skill at picking locks.	You have no skill at picking locks.
You've already unlocked the chest. 	You've already unlocked the chest. 
You don't see any locks here. 	You don't see any locks here. 
You're not close enough.	You're not close enough.
You will have to open the chest first.  It seems to be locked.	You will have to open the chest first.  It seems to be locked.
The chest is now empty.  Funny thing, that. 	The chest is now empty.  Funny thing, that. 
There is no sign of any other treasure in the cavern.	There is no sign of any other treasure in the cavern.
You don't *see* any treasure here.	You don't *see* any treasure here.
Where the chest was, you see numerous pieces of gold and silver.	Where the chest was, you see numerous pieces of gold and silver.
You see the outline of a chest glowing in the south end of the cavern.	You see the outline of a chest glowing in the south end of the cavern.
You can detect a faint glimmering of magic from the shattered remains of the chest.	You can detect a faint glimmering of magic from the shattered remains of the chest.
A strong magical aura radiates from the Kobold's key.	A strong magical aura radiates from the Kobold's key.
There no longer seem to be any magical effects or spells active in this part of the cavern.	There no longer seem to be any magical effects or spells active in this part of the cavern.
Uh oh, you've woken the Kobold.	Uh oh, you've woken the Kobold.
You now have the Kobold's key.  Nice work!	You now have the Kobold's key.  Nice work!
The fungus is slimy and firmly attached to the cave walls.  You'd better leave it alone.	The fungus is slimy and firmly attached to the cave walls.  You'd better leave it alone.
Phosphorescent fungi illuminate the cavern with an unearthly glow.	Phosphorescent fungi illuminate the cavern with an unearthly glow.
You retrieve the dropped key.	You retrieve the dropped key.
You see a large, brass key lying on the ground.  A faint glow emanates from the key.	You see a large, brass key lying on the ground.  A faint glow emanates from the key.
Your foot slips on the wet cavern floor and makes a scuffing noise.	Your foot slips on the wet cavern floor and makes a scuffing noise.
There are no monsters here to attack.	There are no monsters here to attack.
That's what you're doing.  Keep going!	That's what you're doing.  Keep going!
Uh oh.  You weren't stealthy enough.  You have awoken the Kobold.	Uh oh.  You weren't stealthy enough.  You have awoken the Kobold.
You can't reach the key from here.	You can't reach the key from here.
The Kobold won't let you near his key.	The Kobold won't let you near his key.
You take the Kobold's glowing key.	You take the Kobold's glowing key.
VERY carefully, you remove the key from around the Kobold's neck.	VERY carefully, you remove the key from around the Kobold's neck.
The strange creature is dressed in ragged clothes.  It has large, pale eyes. It must have spent its entire life in these caves!	The strange creature is dressed in ragged clothes.  It has large, pale eyes. It must have spent its entire life in these caves!
A large, brass key hangs from a thong around the creature's neck.	A large, brass key hangs from a thong around the creature's neck.
The Kobold seems more interested in frying you with Ball Lightning than in talking to you.	The Kobold seems more interested in frying you with Ball Lightning than in talking to you.
The invisible lid of the invisible chest lifts.  A ripple of magical heat in the air informs you of a trap narrowly avoided by your skillful use of the Open spell.	The invisible lid of the invisible chest lifts.  A ripple of magical heat in the air informs you of a trap narrowly avoided by your skillful use of the Open spell.
You open the chest, remove its contents, and close it again.  You are now 10 gold and 60 silver pieces richer. 	You open the chest, remove its contents, and close it again.  You are now 10 gold and 60 silver pieces richer. 
You don't have time for that.	You don't have time for that.
You pry at the sealed lid of the chest, and... 	You pry at the sealed lid of the chest, and... 
This section of cave has an eerie quality.  You see a kobold resting on a ledge across from you.	This section of cave has an eerie quality.  You see a kobold resting on a ledge across from you.
Wow!  The chest must have been booby-trapped.  You can really feel the damage from the blast. 	Wow!  The chest must have been booby-trapped.  You can really feel the damage from the blast. 
You hear a very satisfying "Snick" as your pick catches the lock just right. 	You hear a very satisfying "Snick" as your pick catches the lock just right. 
Then you sense powerful magics dissipating around the lock, and your hands shake as you realize you have narrowly avoided some sort of Magical Doom.	Then you sense powerful magics dissipating around the lock, and your hands shake as you realize you have narrowly avoided some sort of Magical Doom.
Your fingers shift slightly, and you feel an odd prickling sensation coming from the lock.  You have a bad feeling about this.	Your fingers shift slightly, and you feel an odd prickling sensation coming from the lock.  You have a bad feeling about this.
You hack and pry at the chest, but you are not strong enough to force its lid.	You hack and pry at the chest, but you are not strong enough to force its lid.
The Kobold casts a spell with which you are not familiar.	The Kobold casts a spell with which you are not familiar.
You add ten gold and sixty silver coins to your money pouch.	You add ten gold and sixty silver coins to your money pouch.
You go!  You no stay here!	You go!  You no stay here!
You don't need to cast Fetch -- everything here is in easy reach.	You don't need to cast Fetch -- everything here is in easy reach.
This part of the cavern is spacious and multi-leveled.  Phosphorescent fungus illuminates the cavern with an unearthly glow.	This part of the cavern is spacious and multi-leveled.  Phosphorescent fungus illuminates the cavern with an unearthly glow.
On a rocky platform above the cave floor is a Kobold, one of the race of ugly, miserly creatures known for their skill in Magic.	On a rocky platform above the cave floor is a Kobold, one of the race of ugly, miserly creatures known for their skill in Magic.
There's nothing to open here.	There's nothing to open here.
There are no passive spells to trigger here.	There are no passive spells to trigger here.
You'd better not.  This cave is not recommended by the Michelin Guide. 	You'd better not.  This cave is not recommended by the Michelin Guide. 
The stalactites look much like the stalagmites, except that they go the other way. 	The stalactites look much like the stalagmites, except that they go the other way. 
A faint glimmer of sunlight barely illuminates the cave entrance.	A faint glimmer of sunlight barely illuminates the cave entrance.
The Kobold eats its meals on this plain stone table.	The Kobold eats its meals on this plain stone table.
No time for that now!	No time for that now!
You pick up the Kobold's mushrooms and put them in your pack.	You pick up the Kobold's mushrooms and put them in your pack.
Some sort of food (mushrooms?) sits in a pile on the stone table.  It looks almost edible... to a Kobold.	Some sort of food (mushrooms?) sits in a pile on the stone table.  It looks almost edible... to a Kobold.
To the south and east is the forest from which you came. To the north and west are steep cliffs. There are some unusual plants growing out of the side of the cliffs. 	To the south and east is the forest from which you came. To the north and west are steep cliffs. There are some unusual plants growing out of the side of the cliffs. 
They are spitting what seems to be some kind of seed.	They are spitting what seems to be some kind of seed.
The cliff walls are very steep, and they look difficult to climb.	The cliff walls are very steep, and they look difficult to climb.
You've never seen anything quite like them. They're pretty, in a grotesque way.	You've never seen anything quite like them. They're pretty, in a grotesque way.
You'd like to do that, wouldn't you?	You'd like to do that, wouldn't you?
You have no need to take the flowers.	You have no need to take the flowers.
Since the flowers have stopped spitting, the seed might be a little harder to get to.	Since the flowers have stopped spitting, the seed might be a little harder to get to.
Not now!	Not now!
As you attempt to draw your weapon, you lose your balance momentarily.	As you attempt to draw your weapon, you lose your balance momentarily.
Playing catch with the Spirea plants would certainly be fun, but this seed has a future elsewhere.	Playing catch with the Spirea plants would certainly be fun, but this seed has a future elsewhere.
You lose your concentration.	You lose your concentration.
Your skill with the Open spell is not great enough to affect the plants.	Your skill with the Open spell is not great enough to affect the plants.
There is no need to be so destructive.	There is no need to be so destructive.
That spell would damage the seed.  You don't want to do that.	That spell would damage the seed.  You don't want to do that.
You can't see it.	You can't see it.
The large seed spins as it travels through the air.	The large seed spins as it travels through the air.
