Introduction	序章
"Unless you are a very tough fighter, you had best try to get away from it. If you do manage to kill it, then I will pay you five silvers for each claw." 	"Unless you are a very tough fighter, you had best try to get away from it. If you do manage to kill it, then I will pay you five silvers for each claw." 
"The dear child, I can still picture her with her beautiful blond hair done up in braids.  She was so sweet.  It is hard to believe she is gone."	"The dear child, I can still picture her with her beautiful blond hair done up in braids.  She was so sweet.  It is hard to believe she is gone."
"If you know the ingredients and then bring them here, I can make you such a potion."	"If you know the ingredients and then bring them here, I can make you such a potion."
"I had heard that there was a Dryad in the woods somewhere.  I've never met anyone who actually spoke with her before.  How very interesting."	"I had heard that there was a Dryad in the woods somewhere.  I've never met anyone who actually spoke with her before.  How very interesting."
"Fairy Dust obviously comes from fairies.  They dance around mushroom rings when it is night.  Fairies are magical beings, so be careful around them."	"Fairy Dust obviously comes from fairies.  They dance around mushroom rings when it is night.  Fairies are magical beings, so be careful around them."
"Would you believe the brigands almost killed him a while back?  Fortunately their leader made them bring Heinrich here where I could heal him." 	"Would you believe the brigands almost killed him a while back?  Fortunately their leader made them bring Heinrich here where I could heal him." 
"I will pay you one silver for each empty flask you bring me so I can use it for more potions."	"I will pay you one silver for each empty flask you bring me so I can use it for more potions."
"I use flowers from Erana's Peace to the north in nearly all my potions. They have some of the magic of the place even when they are dried.  I will pay you five silvers for a flask full of flowers."	"I use flowers from Erana's Peace to the north in nearly all my potions. They have some of the magic of the place even when they are dried.  I will pay you five silvers for a flask full of flowers."
"I'm not sure what kind of water that is."	"I'm not sure what kind of water that is."
"A Fairy Ring is a circle of mushrooms.  Fairies dance in them at night, which makes the mushrooms very magical.  Those fairies are cute, but they play rough!"	"A Fairy Ring is a circle of mushrooms.  Fairies dance in them at night, which makes the mushrooms very magical.  Those fairies are cute, but they play rough!"
"I've never heard of a monster around here with green fur.  Rare things are sometimes by their nature magical."	"I've never heard of a monster around here with green fur.  Rare things are sometimes by their nature magical."
"Well, my name is Amelia Appleberry, but mostly I am just known as the Healer.  I will be happy to sell you some potions.  I live here with my pet, Pterry."	"Well, my name is Amelia Appleberry, but mostly I am just known as the Healer.  I will be happy to sell you some potions.  I live here with my pet, Pterry."
"This potion is used to heal damage and keep wounds from getting worse.  It has gotten pretty dangerous around here, and a Healing Potion can be quite useful in a serious situation."	"This potion is used to heal damage and keep wounds from getting worse.  It has gotten pretty dangerous around here, and a Healing Potion can be quite useful in a serious situation."
"I heard the brigand Leader ordering those nasty men to bring poor Heinrich here after they hurt him so.  I gave them all a good scolding, you can imagine." 	"I heard the brigand Leader ordering those nasty men to bring poor Heinrich here after they hurt him so.  I gave them all a good scolding, you can imagine." 
"Power Potions restore the energy needed to cast spells."   	"Power Potions restore the energy needed to cast spells."   
"I have the skill to use my magic to create potions.  I am a bit proud about it; not everyone can do that, you know." 	"I have the skill to use my magic to create potions.  I am a bit proud about it; not everyone can do that, you know." 
"Mandrake root is used in a variety of spells, mostly for evil purposes. Mandrake must be pulled from a dead man's grave at midnight.  The root is particularly powerful." 	"Mandrake root is used in a variety of spells, mostly for evil purposes. Mandrake must be pulled from a dead man's grave at midnight.  The root is particularly powerful." 
"I need the mushrooms from a fairy ring to make Power Potions.  I will pay you one gold for some." 	"I need the mushrooms from a fairy ring to make Power Potions.  I will pay you one gold for some." 
"Almost due north of here is the meadow called 'Erana's Peace'."	"Almost due north of here is the meadow called 'Erana's Peace'."
"It is a very magical area and I understand that it is a place of safety.  It is beautiful all year, for the flowers are always in bloom."	"It is a very magical area and I understand that it is a place of safety.  It is beautiful all year, for the flowers are always in bloom."
"Oh, that's my pet, Pterry, the pterosaur.  He has a girl friend, Pteresa, with a nest in the oak outside my door.  Pterry keeps me company and listens while I chatter as I work."	"Oh, that's my pet, Pterry, the pterosaur.  He has a girl friend, Pteresa, with a nest in the oak outside my door.  Pterry keeps me company and listens while I chatter as I work."
"I make and sell Healing Potion, Power Potion, Vigor Potion, and Undead Unguent." 	"I make and sell Healing Potion, Power Potion, Vigor Potion, and Undead Unguent." 
"They are a species of flying lizard.  I understand they can grow quite large in the south."	"They are a species of flying lizard.  I understand they can grow quite large in the south."
"I will give six golds to the person who returns my ring.  It was a gift when I graduated from the College of Healing."	"I will give six golds to the person who returns my ring.  It was a gift when I graduated from the College of Healing."
"My ring is shaped in gold like a braid of the herb Athelas with entwined leaves.  I don't know how I lost it, I hardly ever take it off." 	"My ring is shaped in gold like a braid of the herb Athelas with entwined leaves.  I don't know how I lost it, I hardly ever take it off." 
"He was just a young dashing man when he last rode off; he never returned." 	"He was just a young dashing man when he last rode off; he never returned." 
"I always need ingredients for making potions.  Right now, I need some of Erana's Flowers, Magic Mushrooms, Troll Beard, and, let me think ... Oh, yes, Cheetaur Claws."	"I always need ingredients for making potions.  Right now, I need some of Erana's Flowers, Magic Mushrooms, Troll Beard, and, let me think ... Oh, yes, Cheetaur Claws."
"I will be happy to pay you if you bring me some.  I'll also buy back any empty flasks you have so that I can recycle them.  Waste not, want not, after all."	"I will be happy to pay you if you bring me some.  I'll also buy back any empty flasks you have so that I can recycle them.  Waste not, want not, after all."
"Floating Spirits are the ghosts which usually hang around graveyards at night.  They are dangerous, so don't go near them unless you use Undead Unguent first."	"Floating Spirits are the ghosts which usually hang around graveyards at night.  They are dangerous, so don't go near them unless you use Undead Unguent first."
"Stamina is a measure of the energy the body uses as you work or play."	"Stamina is a measure of the energy the body uses as you work or play."
"Undead Unguent is used to drive off the minor undead such as zombies or floating spirits.  It doesn't last long, so you should use it near where you are going to encounter such things."  	"Undead Unguent is used to drive off the minor undead such as zombies or floating spirits.  It doesn't last long, so you should use it near where you are going to encounter such things."  
"Vigor Potion is used to revitalize yourself after vigorous exercise.  It helps to restore stamina."	"Vigor Potion is used to revitalize yourself after vigorous exercise.  It helps to restore stamina."
"There are not too many zombies in this land, too damp, I suppose.  There are some floating spirits, I have heard."	"There are not too many zombies in this land, too damp, I suppose.  There are some floating spirits, I have heard."
You find that you have less money than you thought, and can't afford to buy a potion.	You find that you have less money than you thought, and can't afford to buy a potion.
You'll have to be more specific.	You'll have to be more specific.
"I need all my flasks for potions.  You'll have to get one somewhere else."	"I need all my flasks for potions.  You'll have to get one somewhere else."
"I don't have any."	"I don't have any."
"I hope this will help you."	"I hope this will help you."
"Please, show some respect."	"Please, show some respect."
"Thank you, I always need flasks."	"Thank you, I always need flasks."
"Oh, thank you for finding my ring.  How I've missed this.  Here are six golds and two Healing Potions for your reward!"	"Oh, thank you for finding my ring.  How I've missed this.  Here are six golds and two Healing Potions for your reward!"
"So you helped the Dryad; that's nice.  She does keep the forest around here healthy.  So that's how to make a Dispel Potion, is it?  Thanks for letting me know." 	"So you helped the Dryad; that's nice.  She does keep the forest around here healthy.  So that's how to make a Dispel Potion, is it?  Thanks for letting me know." 
"I wouldn't know what to do with that." 	"I wouldn't know what to do with that." 
"Thank you, but I have all the flowers I need."	"Thank you, but I have all the flowers I need."
"Thank you.  I can always use flowers from Erana's Peace in potion making. Here are your silvers."	"Thank you.  I can always use flowers from Erana's Peace in potion making. Here are your silvers."
You put them away.	You put them away.
"Thank you.  I'll save this for a later use."	"Thank you.  I'll save this for a later use."
"Those Meeps sound so interesting.  I'd like to meet them sometime.  I'll get to work on that potion of yours." 	"Those Meeps sound so interesting.  I'd like to meet them sometime.  I'll get to work on that potion of yours." 
"So, you say this is one of the ingredients for the Dispel Potion.  Well, I had better get started making it."	"So, you say this is one of the ingredients for the Dispel Potion.  Well, I had better get started making it."
"Thank you.  I'm sure that I'll find a good use for Fairy Dust."	"Thank you.  I'm sure that I'll find a good use for Fairy Dust."
"I don't need any more Flying Water.  Thank you anyway."	"I don't need any more Flying Water.  Thank you anyway."
"Thank you for the offer, but I really don't need any water."	"Thank you for the offer, but I really don't need any water."
The Healer makes some sort of arcane gesture over the flask of water, then looks surprised.	The Healer makes some sort of arcane gesture over the flask of water, then looks surprised.
"I'm sorry, but this water does not seem to have any magical potential at all.  This can't be the `Flying Water' you described."	"I'm sorry, but this water does not seem to have any magical potential at all.  This can't be the `Flying Water' you described."
The Healer makes some sort of arcane gesture over the flask of water, then smiles.	The Healer makes some sort of arcane gesture over the flask of water, then smiles.
"Flying Water.  How clever."	"Flying Water.  How clever."
"Thank you, but I have enough mushrooms."	"Thank you, but I have enough mushrooms."
"These are very nice.  I'll dry them and grind them into a powder."	"These are very nice.  I'll dry them and grind them into a powder."
"Let me think, oh yes, I said these are worth a gold.  Here you are."	"Let me think, oh yes, I said these are worth a gold.  Here you are."
You put it away.	You put it away.
"You have ruined the mushrooms with toadstools.  I can not buy your mushrooms."	"You have ruined the mushrooms with toadstools.  I can not buy your mushrooms."
"Do you mean to tell me that you actually managed to kill a Cheetaur?  You're quite a hero, aren't you?" 	"Do you mean to tell me that you actually managed to kill a Cheetaur?  You're quite a hero, aren't you?" 
"Here is your money. You might think about purchasing a Healing Potion in case you have to fight such monsters again."	"Here is your money. You might think about purchasing a Healing Potion in case you have to fight such monsters again."
"Don't tell me you actually killed a Troll?  Why, you are really amazing. I haven't had any Troll's Beard for a long time.  There are two healing potions for the beard." 	"Don't tell me you actually killed a Troll?  Why, you are really amazing. I haven't had any Troll's Beard for a long time.  There are two healing potions for the beard." 
They are ingredients the healer uses to make her potions. 	They are ingredients the healer uses to make her potions. 
Soup is good for you.  Mmmm Mmmm good.	Soup is good for you.  Mmmm Mmmm good.
It's not your soup.	It's not your soup.
It's a ladder up to the loft where the Healer has her personal quarters.  No, you can't go up the ladder.	It's a ladder up to the loft where the Healer has her personal quarters.  No, you can't go up the ladder.
Don't be nosy.	Don't be nosy.
The pterosaur's litter box.	The pterosaur's litter box.
Amelia uses a wide variety of pots to make her magical potions.	Amelia uses a wide variety of pots to make her magical potions.
Do you want to burn yourself?  Those pots are hot! 	Do you want to burn yourself?  Those pots are hot! 
You see a winged lizard much like the one you saw outside.	You see a winged lizard much like the one you saw outside.
Small on a prehistoric scale, but still a pterosaur.	Small on a prehistoric scale, but still a pterosaur.
"I cannot make you another Dispel Potion unless you can convince the Dryad to give you another magic acorn.  I do not think that is likely."	"I cannot make you another Dispel Potion unless you can convince the Dryad to give you another magic acorn.  I do not think that is likely."
You tell the healer that you have been to visit the Dryad of the Woods, and that she gave you a Magic Acorn and told you the formula for a potion to dispel enchantments.  	You tell the healer that you have been to visit the Dryad of the Woods, and that she gave you a Magic Acorn and told you the formula for a potion to dispel enchantments.  
"Oh, by the way, if you happen to find a ring on your adventures, I lost my favorite gold ring.  I will give a reward to the one who returns it."	"Oh, by the way, if you happen to find a ring on your adventures, I lost my favorite gold ring.  I will give a reward to the one who returns it."
"Here is the potion of Dispel!" 	"Here is the potion of Dispel!" 
"Use it by splashing it on the victim of a magic spell.  Mind you, this won't work if the spell is caused by a magic item; that type of magic can only be removed by taking away the item." 	"Use it by splashing it on the victim of a magic spell.  Mind you, this won't work if the spell is caused by a magic item; that type of magic can only be removed by taking away the item." 
"Please leave me to make the potion, and when you return I shall have it for you." 	"Please leave me to make the potion, and when you return I shall have it for you." 
"If you know the ingredients for a Dispel Potion and bring them here, I can make you such a potion."	"If you know the ingredients for a Dispel Potion and bring them here, I can make you such a potion."
"The Dispel Potion will take a while to make.  Why don't you come back later?"	"The Dispel Potion will take a while to make.  Why don't you come back later?"
"Well, what can I do for you this time?"	"Well, what can I do for you this time?"
The fragrances of herbs mingle with some rather unpleasant odors as you step into the healer's house.  	The fragrances of herbs mingle with some rather unpleasant odors as you step into the healer's house.  
You put the reward away, and tell her she is welcome, as you leave to avoid being kissed again.  	You put the reward away, and tell her she is welcome, as you leave to avoid being kissed again.  
"Lovely day, isn't it?  My, you look very healthy for an adventurer.  You must be new."	"Lovely day, isn't it?  My, you look very healthy for an adventurer.  You must be new."
"What can I do for you?  I can sell you healing potions if you like."	"What can I do for you?  I can sell you healing potions if you like."
"I also buy spell components if you are interested in gathering some for me. Don't mind me, I always have so much to do around here."	"I also buy spell components if you are interested in gathering some for me. Don't mind me, I always have so much to do around here."
You see a clean but very cluttered little hut filled with bottles and potions.  The Healer is busy puttering around with her potions.	You see a clean but very cluttered little hut filled with bottles and potions.  The Healer is busy puttering around with her potions.
There is a small flying creature preening itself on the rafter.  A ladder leads to the loft above.  A pot over the fire simmers with herbs.  It is pleasantly warm in here.	There is a small flying creature preening itself on the rafter.  A ladder leads to the loft above.  A pot over the fire simmers with herbs.  It is pleasantly warm in here.
You can buy potions, get information, or sell ingredients here.	You can buy potions, get information, or sell ingredients here.
There is an aura of magic throughout this small cabin.	There is an aura of magic throughout this small cabin.
"Come back in the morning, please."	"Come back in the morning, please."
You don't really think that is the correct way to win this game, do you? 	You don't really think that is the correct way to win this game, do you? 
You see bottles and flasks of a wide variety of different potions.	You see bottles and flasks of a wide variety of different potions.
You carefully grab a couple of Healing Potions and conceal them under your cape.	You carefully grab a couple of Healing Potions and conceal them under your cape.
If you're going to steal, at least wait until the Healer is not looking.	If you're going to steal, at least wait until the Healer is not looking.
You're getting greedy.  She'll notice if you take any more.	You're getting greedy.  She'll notice if you take any more.
The healer uses this table as a workbench. 	The healer uses this table as a workbench. 
You see a few odds and ends (not to mention This and That). 	You see a few odds and ends (not to mention This and That). 
The view from the window has been obscured by soot from the fire.	The view from the window has been obscured by soot from the fire.
It's snow. 	It's snow. 
The cave looks very eerie and ominous.	The cave looks very eerie and ominous.
Better watch out -- those icicles look sharp!	Better watch out -- those icicles look sharp!
Although the cave mouth looks like a mouth, and opens and shuts like a mouth, I'm afraid it doesn't know how to talk like a mouth.	Although the cave mouth looks like a mouth, and opens and shuts like a mouth, I'm afraid it doesn't know how to talk like a mouth.
From the blue color of his skin and his huge height, you can tell this is a Frost Giant.	From the blue color of his skin and his huge height, you can tell this is a Frost Giant.
The gem glows like an aurora in the night sky.	The gem glows like an aurora in the night sky.
The Giant looks at you in disgust.  Apparently, you did not offer what he desires. 	The Giant looks at you in disgust.  Apparently, you did not offer what he desires. 
Bargain	Bargain
Brauggi	Brauggi
Hunger	Hunger
Mead	Mead
Northlands	Northlands
"Find me some fruit for to mellow my mead horn, Gift I will give of a gem that now glows --"	"Find me some fruit for to mellow my mead horn, Gift I will give of a gem that now glows --"
"Jewel from Jotunheim, flare of the frost flame, Fetch to me fruit that will fill up my fists!"     	"Jewel from Jotunheim, flare of the frost flame, Fetch to me fruit that will fill up my fists!"     
(It looks like it will take a lot of fruit to fill up THOSE fists!)  	(It looks like it will take a lot of fruit to fill up THOSE fists!)  
"Brauggi I be, to boast of my boldness, Strong as the storm that sends forth the snow."  	"Brauggi I be, to boast of my boldness, Strong as the storm that sends forth the snow."  
"Fiercer in fighting than foes in their fury, Fear now this Frost Giant fighter and flee!"  	"Fiercer in fighting than foes in their fury, Fear now this Frost Giant fighter and flee!"  
"Fiercer than frost's bite, my fury is fearless, My axe it is edged as is the ice."	"Fiercer than frost's bite, my fury is fearless, My axe it is edged as is the ice."
"This warrior is willing to wield now the war drum, The battleaxe blazes and bellows for blood."   	"This warrior is willing to wield now the war drum, The battleaxe blazes and bellows for blood."   
"Highpoint of harvest, the finest of flavor, Apples or oranges, peaches or pears."  	"Highpoint of harvest, the finest of flavor, Apples or oranges, peaches or pears."  
"Glow of the frost flame that fills up the night field, A jewel that is flawless, the finest of gems."  	"Glow of the frost flame that fills up the night field, A jewel that is flawless, the finest of gems."  
"Hollow my food house, for my hunt has been hindered, By having to hurry here from my home."  	"Hollow my food house, for my hunt has been hindered, By having to hurry here from my home."  
"Mead is the mother's milk, mighty yet mellow That brings joy to Giants and madness to men."  	"Mead is the mother's milk, mighty yet mellow That brings joy to Giants and madness to men."  
"Far from the frost field, fares forth this fighter, Hunger has hurled me hither from home." 	"Far from the frost field, fares forth this fighter, Hunger has hurled me hither from home." 
"My name it is known in the Northlands as Brauggi, Barter with blade's clash, or bargain with me."     	"My name it is known in the Northlands as Brauggi, Barter with blade's clash, or bargain with me."     
The log is covered with a layer of late winter snow.	The log is covered with a layer of late winter snow.
Leave it alone; you don't know where that log's been. 	Leave it alone; you don't know where that log's been. 
I'm sure that was fun; why don't you talk to a twig next? 	I'm sure that was fun; why don't you talk to a twig next? 
You can see a small patch of sky through the trees.	You can see a small patch of sky through the trees.
That's it; reach for the sky!	That's it; reach for the sky!
It's a bit late in the season for skiing.	It's a bit late in the season for skiing.
Maybe if you reach those mountains, you'll become a true hero. 	Maybe if you reach those mountains, you'll become a true hero. 
I don't think talking to a mountain is healthy. 	I don't think talking to a mountain is healthy. 
"Fruit you have found, to fill all my food stores, Thus filled the bargain, my gem you have bought."  	"Fruit you have found, to fill all my food stores, Thus filled the bargain, my gem you have bought."  
"Brauggi has bartered, and all has been answered; The mead it may mellow, and now I head home."     	"Brauggi has bartered, and all has been answered; The mead it may mellow, and now I head home."     
"Courage you carry,  but skill it is scanty; Face not this foe  before fiercer you fight."   	"Courage you carry,  but skill it is scanty; Face not this foe  before fiercer you fight."   
Brauggi strides off through the cave on his way back to his Northern home.	Brauggi strides off through the cave on his way back to his Northern home.
Your fruit definitely makes a generous pile in the Giant's cupped hands, but they're not full yet.	Your fruit definitely makes a generous pile in the Giant's cupped hands, but they're not full yet.
Running on the ice is apparently not a very good idea.	Running on the ice is apparently not a very good idea.
As you begin to cast your spell...	As you begin to cast your spell...
Oops.  You're not carrying any fruit for the Frost Giant.   	Oops.  You're not carrying any fruit for the Frost Giant.   
Your meagre selection of fruit makes a paltry pile at the bottom of the Giant's cupped hands.  You'll need to get quite a few more apples to fill THOSE hands!	Your meagre selection of fruit makes a paltry pile at the bottom of the Giant's cupped hands.  You'll need to get quite a few more apples to fill THOSE hands!
As you start to throw...	As you start to throw...
The mountains rise quickly from this point and are covered with snow.  To the west, you can see that the snow has melted in most of the forest, but here it is still heavy. 	The mountains rise quickly from this point and are covered with snow.  To the west, you can see that the snow has melted in most of the forest, but here it is still heavy. 
Brauggi has departed on the long journey to his homeland.	Brauggi has departed on the long journey to his homeland.
Brauggi has become impatient with your questions and gone elsewhere.  You will have to return another time. 	Brauggi has become impatient with your questions and gone elsewhere.  You will have to return another time. 
The Giant (who does not seem pleased at your casting a spell in his presence) radiates a magical aura.  The strongest magic centers on the glowing gem at his belt.	The Giant (who does not seem pleased at your casting a spell in his presence) radiates a magical aura.  The strongest magic centers on the glowing gem at his belt.
