Introduction	序章
There appear to be stairs leading up (?) to nowhere.  There is also what looks like a bowl full of fireflies.  	There appear to be stairs leading up (?) to nowhere.  There is also what looks like a bowl full of fireflies.  
With the Brigands pounding at the door, you decide not to rest until you're safe.	With the Brigands pounding at the door, you decide not to rest until you're safe.
Stairs lead up to the platform on which "ME" is located.	Stairs lead up to the platform on which "ME" is located.
Why would you want to throw that?	Why would you want to throw that?
"No more talking, my friend.  Let's have fun!"	"No more talking, my friend.  Let's have fun!"
You're too busy.	You're too busy.
"It looks like the talking is over."	"It looks like the talking is over."
"Would he be surprised to see his little girl now!"	"Would he be surprised to see his little girl now!"
"Everybody needs to know a few magic tricks to get by these days.  You'd be surprised how effective Sleeping Powder is for taking out the guards of a caravan."	"Everybody needs to know a few magic tricks to get by these days.  You'd be surprised how effective Sleeping Powder is for taking out the guards of a caravan."
"You know about the enchantment?  Then perhaps you have come to help. Perhaps you are able to take the child from the band."	"You know about the enchantment?  Then perhaps you have come to help. Perhaps you are able to take the child from the band."
"Elsa doesn't know who she really is.  That's part of the enchantment."	"Elsa doesn't know who she really is.  That's part of the enchantment."
"When Elsa was left with some brigands ten years ago, all her memories were taken away from her."	"When Elsa was left with some brigands ten years ago, all her memories were taken away from her."
"I borrowed a Magic Mirror from a friend to try to break the spell, but it only works when spells are cast directly at you."	"I borrowed a Magic Mirror from a friend to try to break the spell, but it only works when spells are cast directly at you."
"If you're going to be the big Hero, I hope you brought a Dispel Potion or something."	"If you're going to be the big Hero, I hope you brought a Dispel Potion or something."
"The true Dispel Potion will break an enchantment.  You must splash the potion on Elsa as soon as you can, or she'll skewer you for sure.  She's more than a match for old 'Swordy Lordy' now!"	"The true Dispel Potion will break an enchantment.  You must splash the potion on Elsa as soon as you can, or she'll skewer you for sure.  She's more than a match for old 'Swordy Lordy' now!"
"You know Elsa?  Then perhaps you have come to help.  Perhaps you are able to take the child from the band."	"You know Elsa?  Then perhaps you have come to help.  Perhaps you are able to take the child from the band."
After you have explained what you know about Elsa, Yorick speaks:	After you have explained what you know about Elsa, Yorick speaks:
"It's about time that someone else helped Elsa before it's too late! Toro and I are the only friends she's got here."	"It's about time that someone else helped Elsa before it's too late! Toro and I are the only friends she's got here."
"She's a lot like her dad, though.  She organized these brigands and changed them from mere thugs to major raiders!" 	"She's a lot like her dad, though.  She organized these brigands and changed them from mere thugs to major raiders!" 
"She plans to move the entire band away from the valley as soon as the snow clears.  If that happens, I know she will never be disenchanted."	"She plans to move the entire band away from the valley as soon as the snow clears.  If that happens, I know she will never be disenchanted."
"There are plenty of doors.  You wouldn't want me to spoil your fun, now!"	"There are plenty of doors.  You wouldn't want me to spoil your fun, now!"
"Either you'll figure it out in the end, or you'll end it before you're out."	"Either you'll figure it out in the end, or you'll end it before you're out."
"This fort is the brigand's palace.  It has been well-constructed."	"This fort is the brigand's palace.  It has been well-constructed."
"For thirty years I was the Court Jester.  Now I jest enjoy watching other people take the pratfalls."	"For thirty years I was the Court Jester.  Now I jest enjoy watching other people take the pratfalls."
"I'll protect the Brigand Leader with everything I've got.  That's no laughing matter as I get madder."	"I'll protect the Brigand Leader with everything I've got.  That's no laughing matter as I get madder."
"This room is my way of keeping the brigands from bothering the Leader about raises, since it tends to raze the brigands."	"This room is my way of keeping the brigands from bothering the Leader about raises, since it tends to raze the brigands."
"I designed it myself!  This place has people rolling in the aisles."	"I designed it myself!  This place has people rolling in the aisles."
"Can't you see that I am he?  I try to inspire (before they expire) a sense of awe and majesty in those that enter here."	"Can't you see that I am he?  I try to inspire (before they expire) a sense of awe and majesty in those that enter here."
"After all, I am the Brigand Warlock.  One has to keep up one's appearances, or appear to keep up with one's peers."	"After all, I am the Brigand Warlock.  One has to keep up one's appearances, or appear to keep up with one's peers."
"Toro is the minotaur that guards this fortress.  Elsa found him when he was just a calf, and he's kowtowed to her ever since."	"Toro is the minotaur that guards this fortress.  Elsa found him when he was just a calf, and he's kowtowed to her ever since."
"He guarantees that the brigands won't give Elsa any bull."	"He guarantees that the brigands won't give Elsa any bull."
"Ah yes, the 'Mirror with the Leer', as Erasmus calls it (or was it Fenrus?). It reflects a spell back on the caster of the spell."	"Ah yes, the 'Mirror with the Leer', as Erasmus calls it (or was it Fenrus?). It reflects a spell back on the caster of the spell."
"Now where did I put that mirror... Was it on the desk in Elsa's office or else in the office on Elsa's desk?" 	"Now where did I put that mirror... Was it on the desk in Elsa's office or else in the office on Elsa's desk?" 
"You snooze, you lose.  And my banana trick has appeal of its own."	"You snooze, you lose.  And my banana trick has appeal of its own."
"You must know the 'Blade Braggart'.  He used to show off in the castle courtyard all the time."	"You must know the 'Blade Braggart'.  He used to show off in the castle courtyard all the time."
"Elsa once asked if 'Rapier Ruler' would teach her to use the sword, and the 'Sword Bore' told her he would not waste his talent on females." 	"Elsa once asked if 'Rapier Ruler' would teach her to use the sword, and the 'Sword Bore' told her he would not waste his talent on females." 
"She came to me in tears.  After all, she was only nine at the time."	"She came to me in tears.  After all, she was only nine at the time."
"She can teach old 'Weapon Windbag' a thing or two now!  Her arm is true, and she's truly disarming." 	"She can teach old 'Weapon Windbag' a thing or two now!  Her arm is true, and she's truly disarming." 
"Talking is a speciality of those who know not what they talk about."	"Talking is a speciality of those who know not what they talk about."
"You know me?  Then perhaps you have come to help.  Perhaps you are able to take the child from the band."	"You know me?  Then perhaps you have come to help.  Perhaps you are able to take the child from the band."
"Alas, poor Yorick!  I know me well."	"Alas, poor Yorick!  I know me well."
"Ten years ago, I swore I would find Elsa no matter what.  It took me two years to find her, here with the brigands, and I've posed as her warlock ever since."	"Ten years ago, I swore I would find Elsa no matter what.  It took me two years to find her, here with the brigands, and I've posed as her warlock ever since."
"I couldn't break the spell on her, nor could I leave her to grow up into an attractive woman surrounded by rogues and scoundrels."	"I couldn't break the spell on her, nor could I leave her to grow up into an attractive woman surrounded by rogues and scoundrels."
"Someone had to defend her honor!"	"Someone had to defend her honor!"
"Take yourself there."	"Take yourself there."
"ME" sees you preparing your spell and...	"ME" sees you preparing your spell and...
Now?? 	Now?? 
"It's 'ME'." 	"It's 'ME'." 
Caravan	Caravan
Disenchantment	Disenchantment
Dispel	Dispel
"Be more specific, my friend."	"Be more specific, my friend."
Exit	Exit
Fortress	Fortress
Jester	Jester
"If you have business to do, then get busy doing your business."	"If you have business to do, then get busy doing your business."
Maze	Maze
Me	Me
Minotaur	Minotaur
"Can't you see that's nothing to me?  You'd better flee."	"Can't you see that's nothing to me?  You'd better flee."
"The brigands will come to spoil your fun.  You'll be undone."	"The brigands will come to spoil your fun.  You'll be undone."
"The brigands tend to hold a grudge, and they won't begrudge to tend to you."	"The brigands tend to hold a grudge, and they won't begrudge to tend to you."
"If you have any famous last statements, you'd better say the secret word, or you'll lament your last state."	"If you have any famous last statements, you'd better say the secret word, or you'll lament your last state."
Potion	Potion
"Of which potion do you speak?"	"Of which potion do you speak?"
Powder	Powder
Swordy Lordy	Swordy Lordy
Yorick	Yorick
A quick but thorough search of the desk discloses two Healing Potions and a mirror.	A quick but thorough search of the desk discloses two Healing Potions and a mirror.
You find nothing more.	You find nothing more.
You see a mirror.	You see a mirror.
You find two Healing Potions.	You find two Healing Potions.
You see a plain wooden desk.  On the desk are two potion bottles and a hand mirror.	You see a plain wooden desk.  On the desk are two potion bottles and a hand mirror.
That would be foolhardy.  You would let the brigands in.	That would be foolhardy.  You would let the brigands in.
The chest full of gems is monogrammed with the name "Abdulla Doo".  He'll sure be happy to get it back. 	The chest full of gems is monogrammed with the name "Abdulla Doo".  He'll sure be happy to get it back. 
There are more diamonds there than in Tiffany's! 	There are more diamonds there than in Tiffany's! 
A lot of townsfolk will be happy to get their stolen goods back. 	A lot of townsfolk will be happy to get their stolen goods back. 
You throw the Dispel Potion on the brigand leader.	You throw the Dispel Potion on the brigand leader.
Good idea, but you don't have that potion.	Good idea, but you don't have that potion.
The brigand leader wears a sword, and it looks well used.	The brigand leader wears a sword, and it looks well used.
Elsa looks much better in a dress.	Elsa looks much better in a dress.
It depends on your taste, though, I suppose.	It depends on your taste, though, I suppose.
Everybody else is gone.	Everybody else is gone.
The Brigand Leader stares at you coldly.  It seems he's not interested in chatter.	The Brigand Leader stares at you coldly.  It seems he's not interested in chatter.
"We've no time to talk.  I'll meet you at the castle."	"We've no time to talk.  I'll meet you at the castle."
That black bird looks strangely familiar.  You sense that its destiny is irrevocably entwined with yours, in a strange foreshadowing of the rest of the "Quest for Glory" series.	That black bird looks strangely familiar.  You sense that its destiny is irrevocably entwined with yours, in a strange foreshadowing of the rest of the "Quest for Glory" series.
Oodles and boodles of ill-booten gotty. 	Oodles and boodles of ill-booten gotty. 
Let's see, was it the "dragon with the flagon", or the "flagon with the dragon"?	Let's see, was it the "dragon with the flagon", or the "flagon with the dragon"?
That gold ornament probably weighs so much it would crumple the hood of your car. 	That gold ornament probably weighs so much it would crumple the hood of your car. 
It looks like King Midas's shield -- worth exactly its weight in gold. 	It looks like King Midas's shield -- worth exactly its weight in gold. 
You're not near the mirror.	You're not near the mirror.
You already have the mirror.	You already have the mirror.
You pick up the mirror and store it away.	You pick up the mirror and store it away.
A strange face leers at you when you look into the mirror.  At least, you *hope* you don't look like that!	A strange face leers at you when you look into the mirror.  At least, you *hope* you don't look like that!
You place the two Healing Potions into your pack.	You place the two Healing Potions into your pack.
You are not near the healing potions.  	You are not near the healing potions.  
It's a healing potion. 	It's a healing potion. 
"You can't imagine how good it feels to know who I am again.  After all these years, to remember my name is Elsa von Spielburg!"	"You can't imagine how good it feels to know who I am again.  After all these years, to remember my name is Elsa von Spielburg!"
"I used to wish I was not a brigand's child but actually an enchanted princess.  Now I know that I really was enchanted, and I don't have to be a brigand any more!"	"I used to wish I was not a brigand's child but actually an enchanted princess.  Now I know that I really was enchanted, and I don't have to be a brigand any more!"
"Thank you so much for freeing me."	"Thank you so much for freeing me."
"I've got to hurry home to father and get his guards to capture the rest of the brigands before they manage to escape with the treasure. It must be returned to the rightful owners."	"I've got to hurry home to father and get his guards to capture the rest of the brigands before they manage to escape with the treasure. It must be returned to the rightful owners."
"Yorick!  Yorick!  I'm me again!"	"Yorick!  Yorick!  I'm me again!"
"Sorry I took so long.  I got lost."	"Sorry I took so long.  I got lost."
"Will your Dad be glad that your spell's been repelled!  We need to go before the brigands know or they'll spoil our show."	"Will your Dad be glad that your spell's been repelled!  We need to go before the brigands know or they'll spoil our show."
"C'mon!  We'd better make our getaway before they get in our way."	"C'mon!  We'd better make our getaway before they get in our way."
"Yorick and I can return to the castle with the amulet I wear, but I'm afraid you'll have to get there on your own."	"Yorick and I can return to the castle with the amulet I wear, but I'm afraid you'll have to get there on your own."
"There are two Healing Potions on my desk that you may take with you."	"There are two Healing Potions on my desk that you may take with you."
"You should use this secret passage and escape while they are arguing over the treasure.  If they find you in here, you'll be overwhelmed and killed."	"You should use this secret passage and escape while they are arguing over the treasure.  If they find you in here, you'll be overwhelmed and killed."
"Thank you again, and good luck!  I'll make sure you are richly rewarded for your bravery."	"Thank you again, and good luck!  I'll make sure you are richly rewarded for your bravery."
"If you decide to counter the curser, then mind the mirror over mere minds. So tip the canoe and toodleloo!  Elsa, if you do the honors, I'll honor your due." 	"If you decide to counter the curser, then mind the mirror over mere minds. So tip the canoe and toodleloo!  Elsa, if you do the honors, I'll honor your due." 
The brigands are trying to break into the room.	The brigands are trying to break into the room.
Thinking about all that treasure cost you time and more.  Some folks just don't know when to leave. 	Thinking about all that treasure cost you time and more.  Some folks just don't know when to leave. 
"Elsa, my dear, there's a problem I fear.  To our dismay, that spell's here to stay, for alas you did slay your hero today." 	"Elsa, my dear, there's a problem I fear.  To our dismay, that spell's here to stay, for alas you did slay your hero today." 
You finally made it through Yorick's room.	You finally made it through Yorick's room.
The brigand leader taunts you with his stillness.  You're sure that at the first wrong move, you'll become an ex-hero. 	The brigand leader taunts you with his stillness.  You're sure that at the first wrong move, you'll become an ex-hero. 
Too late! 	Too late! 
There's so much magic in here that it's hard for you tell which is which. 	There's so much magic in here that it's hard for you tell which is which. 
After hours of hard and dangerous labor collecting the components to make the dispel potion, in a moment of sudden genius, you throw the potion away.  It's a brilliant and unexpected strategem.	After hours of hard and dangerous labor collecting the components to make the dispel potion, in a moment of sudden genius, you throw the potion away.  It's a brilliant and unexpected strategem.
Unfortunately, it is also a very bad idea.  You no longer have the Dispel Potion.	Unfortunately, it is also a very bad idea.  You no longer have the Dispel Potion.
The Leader's room is filled with treasures.	The Leader's room is filled with treasures.
That looks like a Persian carpet.  It has a license plate that says "Abdulla Doo 222."	That looks like a Persian carpet.  It has a license plate that says "Abdulla Doo 222."
Sheesh!  Even the lamps have enough gold to be worth more than Jose Canseco's annual salary.  Well, maybe not quite *that* much. 	Sheesh!  Even the lamps have enough gold to be worth more than Jose Canseco's annual salary.  Well, maybe not quite *that* much. 
What a funny guy!	What a funny guy!
He's not here.	He's not here.
The arrows point to various orifices.	The arrows point to various orifices.
It's another door!	It's another door!
It's an entrance... or is it an exit? 	It's an entrance... or is it an exit? 
The attic exit?	The attic exit?
It looks like a picture of an door painted on the wall. 	It looks like a picture of an door painted on the wall. 
A pet door?  It's shorter than you are.	A pet door?  It's shorter than you are.
It's a chain of events.	It's a chain of events.
It reminds you of a tie you once received as a present on All-Fools Day.	It reminds you of a tie you once received as a present on All-Fools Day.
It IS!  It's a bowl of fireflies, used as a light source.  What won't they think of next?	It IS!  It's a bowl of fireflies, used as a light source.  What won't they think of next?
What an interestingly hinged trap door.  What do you suppose would happen if you stepped on it? 	What an interestingly hinged trap door.  What do you suppose would happen if you stepped on it? 
You eat the Magic Acorn.  It tastes terrible.  Better stick to real food next time.	You eat the Magic Acorn.  It tastes terrible.  Better stick to real food next time.
That would make a pretty silly-looking hat.	That would make a pretty silly-looking hat.
Inscribed on the bottom you read, "Property of John B. Nimble." 	Inscribed on the bottom you read, "Property of John B. Nimble." 
You absent-mindedly clean your fingernails with one of the Cheetaur's claws. 	You absent-mindedly clean your fingernails with one of the Cheetaur's claws. 
You don't feel anything.  Perhaps this was not the correct way to use this potion.	You don't feel anything.  Perhaps this was not the correct way to use this potion.
You do a quick equipment check.  Everything seems to be in place.	You do a quick equipment check.  Everything seems to be in place.
You sprinkle just a smidge of the magical dust on and about your person... 	You sprinkle just a smidge of the magical dust on and about your person... 
... and try to fly.  But it appears that none of those Fairies was named Tinker Bell. 	... and try to fly.  But it appears that none of those Fairies was named Tinker Bell. 
It's empty.  Maybe you should recycle it.	It's empty.  Maybe you should recycle it.
Your mother always told you to stop and smell the flowers. 	Your mother always told you to stop and smell the flowers. 
You drink the clear water from the flask, draining it completely. 	You drink the clear water from the flask, draining it completely. 
You eat some of the apples.  They actually taste quite good.	You eat some of the apples.  They actually taste quite good.
It would make a great coat for a Leprechaun. 	It would make a great coat for a Leprechaun. 
The drink soothes as it goes down.	The drink soothes as it goes down.
You fought so hard for this key, you just can't bear to part with it. 	You fought so hard for this key, you just can't bear to part with it. 
The leather makes you think kinky thoughts.  (And you wondered why adventurers dress up this way.)	The leather makes you think kinky thoughts.  (And you wondered why adventurers dress up this way.)
You delicately insert the lockpick into your left nostril.	You delicately insert the lockpick into your left nostril.
Success!  Your nose is now open.	Success!  Your nose is now open.
Unfortunately, you push it in too far, causing yourself a cerebral hemorrhage.  Guess you should have been practicing on less difficult locks.	Unfortunately, you push it in too far, causing yourself a cerebral hemorrhage.  Guess you should have been practicing on less difficult locks.
The surgeon general warns . . . 	The surgeon general warns . . . 
Whatta guy!!	Whatta guy!!
You pause to admire the way the gem glows with its own inner light. 	You pause to admire the way the gem glows with its own inner light. 
What's this?  A chink in your armor?  No, it's just a rust spot. 	What's this?  A chink in your armor?  No, it's just a rust spot. 
Baba Yaga is welcome to it!  If it tastes half as bad as it smells... 	Baba Yaga is welcome to it!  If it tastes half as bad as it smells... 
You foxy devil, you! 	You foxy devil, you! 
That's funny.  I could have sworn I warned you about eating too many Magic Mushrooms.  Your mind permanently warped, you die a garishly polka-dotted death.   	That's funny.  I could have sworn I warned you about eating too many Magic Mushrooms.  Your mind permanently warped, you die a garishly polka-dotted death.   
Where did all the pretty horses go?   	Where did all the pretty horses go?   
Hmm, that was interesting.  But it would probably not be a good idea to repeat the experience.   	Hmm, that was interesting.  But it would probably not be a good idea to repeat the experience.   
You don't need to do that right now.   	You don't need to do that right now.   
Your senses gradually return to normal.	Your senses gradually return to normal.
You ingest a few of the mushrooms from the Fairy Ring.  They taste delicious. 	You ingest a few of the mushrooms from the Fairy Ring.  They taste delicious. 
Wow!  Look at all the nice paisley horses!  	Wow!  Look at all the nice paisley horses!  
Not to mention the beautiful neon sky.  	Not to mention the beautiful neon sky.  
The mushrooms from the Fairy Ring are pretty good, so you hear.  However, when they're mixed with Kobold toadstools... that's a horse of a different color. 	The mushrooms from the Fairy Ring are pretty good, so you hear.  However, when they're mixed with Kobold toadstools... that's a horse of a different color. 
You eat some of the Kobold's fungus.  Within seconds your insides feel like they're on fire.  Guess you're not a Kobold, huh? 	You eat some of the Kobold's fungus.  Within seconds your insides feel like they're on fire.  Guess you're not a Kobold, huh? 
Didn't anyone warn you about eating other people's food?  Death by Toadstools doesn't leave mushroom for improvement.	Didn't anyone warn you about eating other people's food?  Death by Toadstools doesn't leave mushroom for improvement.
You think that you'd better take it easy for a while until you recover.	You think that you'd better take it easy for a while until you recover.
Play it again, Ludwig. 	Play it again, Ludwig. 
You read it again and puzzle over its meaning.	You read it again and puzzle over its meaning.
They're nice, but they don't go with your outfit. 	They're nice, but they don't go with your outfit. 
The rations are tasteless but filling.	The rations are tasteless but filling.
It's not your size. 	It's not your size. 
After wiping the plant saliva from it, you examine the large seed. 	After wiping the plant saliva from it, you examine the large seed. 
That wasn't quite what the Surgeon General meant when he suggested you use a shield.	That wasn't quite what the Surgeon General meant when he suggested you use a shield.
You check to see if your money's still there. Yep, it is. 	You check to see if your money's still there. Yep, it is. 
The drink is invigorating.	The drink is invigorating.
You prepare to fall on your sword, but you finally decide that it would be uncomfortable. 	You prepare to fall on your sword, but you finally decide that it would be uncomfortable. 
You remain amazed at the number and versatility of the little gimcracks and thingamabobs inside your thief's tool kit. 	You remain amazed at the number and versatility of the little gimcracks and thingamabobs inside your thief's tool kit. 
The picture on your thief's license doesn't look a bit like you. 	The picture on your thief's license doesn't look a bit like you. 
You try on the troll beard, but the goat-like smell convinces you to remain clean-shaven for a while. 	You try on the troll beard, but the goat-like smell convinces you to remain clean-shaven for a while. 
The vase makes an even worse hat than the candelabra.	The vase makes an even worse hat than the candelabra.
