The stalagmites grow slowly... or are they stalactites?	石筍生長得很緩慢……或者那是鐘乳石？
What could you possibly do with a stalactite... or is it a stalagmite?	你究竟能拿鐘乳石做什麼……或者那是石筍？
The stalactites grow slowly... or are they stalagmites?	鐘乳石生長得很緩慢……或者那是石筍？
The Kobold doesn't look very calm.  In fact, it looks totally unaffected by your spell.	地精看起來一點都不平靜。實際上，它完全不受你的咒語影響。
You just bumped into something on the floor.  It feels like a large wooden chest, but you don't see anything there.	你剛撞上地板上的東西。感覺像是一個大木箱，但你什麼都看不見。
You will have to open it first.  The chest seems to be locked.	你必須先打開它。寶箱似乎被鎖住了。
You've already taken the treasure.	你已經拿走了寶物。
You are too far away to get the Kobold's treasure.	你距離地精的寶物太遠了。
The key doesn't fit in the chest.  It must be for a different lock.	鑰匙塞不進寶箱。一定是別的鎖用的。
You have no skill at picking locks.	你沒有開鎖的本領。
You've already unlocked the chest. 	你已經打開了寶箱。
You don't see any locks here. 	這裡沒有鎖。
You're not close enough.	你離得不夠近。
You will have to open the chest first.  It seems to be locked.	你必須先打開寶箱。它似乎被鎖住了。
The chest is now empty.  Funny thing, that. 	寶箱現在是空的。真奇怪。
There is no sign of any other treasure in the cavern.	洞穴裡沒有其他寶物的跡象。
You don't *see* any treasure here.	你看不到這裡有什麼寶物。
Where the chest was, you see numerous pieces of gold and silver.	寶箱原本的位置，你看到許多金幣和銀幣。
You see the outline of a chest glowing in the south end of the cavern.	你在洞穴南端看到一個發光的寶箱輪廓。
You can detect a faint glimmering of magic from the shattered remains of the chest.	你能感知到破碎寶箱殘骸中微弱的魔法閃爍。
A strong magical aura radiates from the Kobold's key.	地精的鑰匙散發出強大的魔法光暈。
There no longer seem to be any magical effects or spells active in this part of the cavern.	這部分洞穴中似乎不再有任何魔法效應或咒語活躍。
Uh oh, you've woken the Kobold.	哎喲，你驚動了地精。
You now have the Kobold's key.  Nice work!	你現在拿到了地精的鑰匙。幹得漂亮！
The fungus is slimy and firmly attached to the cave walls.  You'd better leave it alone.	菌類又溼又滑，緊貼在洞壁上。你最好別碰它。
Phosphorescent fungi illuminate the cavern with an unearthly glow.	磷光菌以詭異的光芒照亮洞穴。
You retrieve the dropped key.	你撿起掉落的鑰匙。
You see a large, brass key lying on the ground.  A faint glow emanates from the key.	你看到一把大銅鑰匙躺在地上。鑰匙散發出微弱的光芒。
Your foot slips on the wet cavern floor and makes a scuffing noise.	你的腳在溼滑的洞穴地面上滑了一下，發出擦擦聲。
There are no monsters here to attack.	這裡沒有怪物可以攻擊。
That's what you're doing.  Keep going!	那就是你在做的。繼續加油！
Uh oh.  You weren't stealthy enough.  You have awoken the Kobold.	哎喲。你不夠謹慎。你驚動了地精。
You can't reach the key from here.	你從這裡夠不到鑰匙。
The Kobold won't let you near his key.	地精不會讓你靠近它的鑰匙。
You take the Kobold's glowing key.	你拿起了地精發光的鑰匙。
VERY carefully, you remove the key from around the Kobold's neck.	你非常小心地把鑰匙從地精的脖子上取下來。
The strange creature is dressed in ragged clothes.  It has large, pale eyes. It must have spent its entire life in these caves!	這奇怪的生物穿著破爛衣服。它有雙又大又蒼白的眼睛。它一定在這些洞穴裡度過了整個人生！
A large, brass key hangs from a thong around the creature's neck.	一把大銅鑰匙掛在生物脖子上的皮繩上。
The Kobold seems more interested in frying you with Ball Lightning than in talking to you.	地精似乎對用閃電球炸你比跟你聊天更感興趣。
The invisible lid of the invisible chest lifts.  A ripple of magical heat in the air informs you of a trap narrowly avoided by your skillful use of the Open spell.	隱形寶箱的隱形蓋子打了開來。空氣中的魔法熱浪告訴你，你精妙地使用開啟術躲過了一個陷阱。
You open the chest, remove its contents, and close it again.  You are now 10 gold and 60 silver pieces richer. 	你打開寶箱、取出裡面的東西、再關上。你現在多了 10 金幣和 60 銀幣。
You don't have time for that.	你沒時間做那事。
You pry at the sealed lid of the chest, and... 	你撬著封死的寶箱蓋子，然後……
This section of cave has an eerie quality.  You see a kobold resting on a ledge across from you.	洞穴這一段有股詭異的感覺。你看到一隻地精在對面的突出岩石上休息。
Wow!  The chest must have been booby-trapped.  You can really feel the damage from the blast. 	哇！寶箱一定裝了陷阱。你真的能感受到爆炸的傷害。
You hear a very satisfying "Snick" as your pick catches the lock just right. 	你聽到一聲令人滿意的「喀」聲，你的撬鎖工具完美地卡進了鎖。
Then you sense powerful magics dissipating around the lock, and your hands shake as you realize you have narrowly avoided some sort of Magical Doom.	然後你感受到強大的魔法在鎖周圍消散，當你意識到你勉強躲過某種魔法厄運時，你的手開始發抖。
Your fingers shift slightly, and you feel an odd prickling sensation coming from the lock.  You have a bad feeling about this.	你的手指輕輕移動，你感到鎖傳來奇怪的刺痛感。你有種不好的預感。
You hack and pry at the chest, but you are not strong enough to force its lid.	你砍著寶箱並試圖撬開，但你力氣不夠，無法強行打開蓋子。
The Kobold casts a spell with which you are not familiar.	地精施展了一個你不熟悉的法術。
You add ten gold and sixty silver coins to your money pouch.	你把十枚金幣和六十枚銀幣加進了錢袋。
You go!  You no stay here!	你滾！你別在這裡待著！
You don't need to cast Fetch -- everything here is in easy reach.	你不需要施展取物術──這裡的東西都隨手可得。
This part of the cavern is spacious and multi-leveled.  Phosphorescent fungus illuminates the cavern with an unearthly glow.	洞穴的這部分寬敞且多層次。磷光菌以詭異的光芒照亮洞穴。
On a rocky platform above the cave floor is a Kobold, one of the race of ugly, miserly creatures known for their skill in Magic.	在洞穴地面上方的岩石平台上，有一隻地精。這是一個醜陋、吝嗇的種族，以擅長魔法而聞名。
There's nothing to open here.	這裡沒有東西可以打開。
There are no passive spells to trigger here.	這裡沒有被動法術可以觸發。
You'd better not.  This cave is not recommended by the Michelin Guide. 	你最好別。米其林指南不推薦這個洞穴。
The stalactites look much like the stalagmites, except that they go the other way. 	鐘乳石看起來很像石筍，除了方向相反。
A faint glimmer of sunlight barely illuminates the cave entrance.	微弱的陽光勉強照亮了洞穴入口。
The Kobold eats its meals on this plain stone table.	地精在這個簡樸的石頭桌子上吃飯。
No time for that now!	現在沒時間那樣做！
You pick up the Kobold's mushrooms and put them in your pack.	你撿起地精的蘑菇，放進你的背包。
Some sort of food (mushrooms?) sits in a pile on the stone table.  It looks almost edible... to a Kobold.	某種食物（蘑菇？）堆在石桌上。看起來幾乎可以吃……對地精來說。
To the south and east is the forest from which you came. To the north and west are steep cliffs. There are some unusual plants growing out of the side of the cliffs. 	南邊和東邊是你來時的森林。北邊和西邊是陡峭的懸崖。懸崖側面長著一些不尋常的植物。
They are spitting what seems to be some kind of seed.	它們吐出似乎是某種種子的東西。
The cliff walls are very steep, and they look difficult to climb.	懸崖壁非常陡峭，看起來很難爬。
You've never seen anything quite like them. They're pretty, in a grotesque way.	你從來沒見過這樣的東西。它們有種怪異的美感。
You'd like to do that, wouldn't you?	你想那樣做，是吧？
You have no need to take the flowers.	你沒有必要摘花。
Since the flowers have stopped spitting, the seed might be a little harder to get to.	既然花已經停止吐種子了，種子可能會有點難拿。
Not now!	現在不行！
As you attempt to draw your weapon, you lose your balance momentarily.	你試圖拔出武器時，一時失去了平衡。
Playing catch with the Spirea plants would certainly be fun, but this seed has a future elsewhere.	跟繡線菊植物玩接球遊戲肯定很有趣，但這顆種子有別的用處。
You lose your concentration.	你失去了專注。
Your skill with the Open spell is not great enough to affect the plants.	你的開啟術技巧還不夠強，無法影響植物。
There is no need to be so destructive.	沒必要這麼有破壞性。
That spell would damage the seed.  You don't want to do that.	那個法術會傷害種子。你不想那樣做。
You can't see it.	你看不到它。
The large seed spins as it travels through the air.	大種子在空中飛行時旋轉著。
There's not much point to that now.	現在那樣做沒什麼意義。
Why do you think you're standing like this. Trying to catch Flying Water?	你為什麼站成這樣。想接住飛水？
You can't catch the seed from down on the ground.	你從地上抓不到種子。
Perhaps it would be better to find something else to throw.	也許找別的東西扔比較好。
You might have tried to throw a rock at the seed, but it's too late now.	你可能想過扔石頭打種子，但現在太晚了。
You get in position for a good throw.	你擺好姿勢準備投擲。
You need a good rock to throw.	你需要一塊好石頭來扔。
The meadow clearing in which you stand is grassy and littered with blown pine needles and small mossy rocks.	你站著的草地空地長滿了草，散落著被吹落的松針和長滿苔蘚的小石頭。
Wait a second!	等等！
The leaves look tough and fibrous.	葉子看起來又硬又有纖維。
You've already made a mess of that flower.	你已經把那朵花搞得一團糟了。
There's not much point in that, now that you've already done what you came here to do. 	既然你已經做完了來這裡的目的，那樣做就沒什麼意義了。
This looks like a good place to you.	這看起來像個不錯的地方。
You valiantly scrabble against the cliff wall, but it looks like your climbing skill could stand some improvement.	你勇敢地在懸崖壁上亂抓，但看起來你的攀爬技巧還有待改進。
Perhaps there is some other way to get to your objective.	也許還有其他方式到達你的目標。
You look for an appropriate place to climb.	你尋找適合爬的地方。
You pick up a few small rocks.	你撿起幾塊小石頭。
Unless you just took a kangaroo potion, that plant is too far up the cliff to jump for.	除非你剛喝了袋鼠藥水，不然那株植物在懸崖上太高了，跳不到。
You see the seed floating above the shattered remains of the plant.	你看到種子浮在被摧毀的植物殘骸上方。
You take the seed.	你拿起種子。
You don't need a rock for anything.	你沒有必要用石頭做什麼。
It looks difficult. You look around for a good place to climb.	看起來很難。你四處尋找適合爬的地方。
You put the seed into your pack and climb down.	你把種子放進背包並爬了下去。
You remain unconscious on the ground for an indeterminate amount of time. As you finally revive, you realize that you've caused yourself a fair amount of damage.	你昏迷在地上好一陣子。當你終於清醒過來時，你意識到你對自己造成了相當大的傷害。
Ohhhhhhh!	哦──！
You place the seed into your pack.	你把種子放進背包。
You lose concentration, and the spell fades.  You will have to practice some more.	你失去了專注，咒語消散了。你還得多練習。
You get into a good position.	你擺好位置。
You might have tried to cast a spell at the seed, but it's too late now.	你可能想過對種子施法，但現在太晚了。
You can see pines, cedars, birches and other trees frequently associated with mountain forests.	你能看到松樹、雪松、樺樹和其他常見於山區森林的樹木。
Thick undergrowth stops you from moving north. 	濃密的灌木叢擋住了你向北的去路。
Dense brush blocks your path to the south. 	密集的灌叢擋住了你向南的去路。
That's one mean Ogress!	那真是隻狠辣的女食人妖！
You furtively grasp the Magic Mirror.	你偷偷地抓住了魔鏡。
There's no time for idle chatter.	沒時間閒聊。
There is a bat, all folded up within his wings, hanging on the wall. 	有隻蝙蝠用翅膀把自己包起來，掛在牆上。
You'd better not -- it's not your turn at bat.	你最好別──現在還輪不到你。
The bat must be using a digitized encoding program, as you don't seem to understand the high-pitched squeaks.  	蝙蝠一定在用數位編碼程式，因為你似乎聽不懂那些尖銳的吱吱聲。
It's a broken gate -- every well-furnished apartment should have one.	這是扇破門──每間布置得好的公寓都應該有一扇。
The tag says "Manufactured by Broom Motors, Ltd."  This must be one of those new sports brooms.	標籤上寫著「掃帚馬達公司製造」。這一定是那種新型運動掃帚。
Whatever's in this bucket, it really stinks.	這桶裡不管裝的是什麼，真的臭死了。
You're positive that Baba Yaga could make a fortune if she sold it on the open market. 	你很確定芭芭雅嘎要是在公開市場上賣它，一定能發大財。
The fire burns hot under the kettle.	火在茶壺下面燒得很熱。
There's a lot of SOMETHING cooking away in the huge black cauldron.	巨大的黑色大鍋裡有什麼東西在煮。
The smell is awful, the color is sickening, and you don't even want to know what's being prepared for dinner.	味道很難聞，顏色令人作嘔，你甚至不想知道在準備什麼晚餐。
The stone hearth and chimney radiates too much heat.	石頭壁爐和煙囪散發出太多熱度。
Okay, Okay, so you think there should be a window here?	好吧、好吧，你認為這裡應該有窗戶？
The glass seems to distort the view of the outside world... but which world is it? 	玻璃似乎扭曲了外部世界的景象……但那是哪個世界呢？
Window?  What window?	窗戶？什麼窗戶？
If you didn't know better, you would swear the mural on the wall looks just like an underground cave.  	如果你不了解的話，你會發誓牆上的壁畫看起來就像一個地下洞穴。
