"Does that mean that you tease pickles?"	「那表示你在取笑醃黃瓜嗎？」
"A countercurse is a cure for a curse. It usually works against the one who cast the curse in the first place."	「反詛咒是對詛咒的救治。它通常對施咒者本身有效。」
"The countercurse for the curse of the Baron goes:"	「對男爵詛咒的反詛咒是：」
"Come a Hero from the East..."	「英雄自東方來…」
"Free the man from in the beast..."	「救人於野獸之中…」
"Bring the child from out the band..."	「救孩童脫離匪幫…」
"Drive the Curser from the land."	「驅逐施咒者離此地。」
"So, to break the curse, a hero must get rid of Baba Yaga, in addition to all the other things.  It does not reflect well on Baba Yaga." 	「所以，要破除詛咒，英雄必須除去芭芭雅嘎，以及所有其他事情。這對芭芭雅嘎名聲不太好。」
"Nothing reflects well upon that Ogress.  She has a face that would break anything but a Magic Mirror."	「那個食人妖身上沒什麼能襯托良好形象的。她的臉能破毀一切，除了魔法鏡。」
"The curse Baba Yaga placed upon Baron von Spielburg was a fine example of creative cursing."	「芭芭雅嘎對史蒂芬·馮·史畢柏格男爵的詛咒是創意詛咒的典範。」
"Upon von Spielburg and all his clan, This the curse I now demand:"	「對馮·史畢柏格與其全族，我現下令此詛咒：」
"What I will shall come full measure,    So shall ye lose all that ye treasure." 	「我欲之物必成事實，    爾等將失去一切珍寶。」
"Of course, the problem is that for every curse there is an equal and opposite countercurse."	「當然，問題在於每一個詛咒都有相等且相反的反詛咒。」
"Now that's a spell with charm."	「那真是個有魅力的法術。」
"Its true name is Erasmus's Razzle Dazzle, by the way." 	「順帶一提，它的真名是伊拉斯謨的眩目術。」
"You can cast the spell and anyone looking directly at its coruscating light is blinded for awhile and can't do anything." 	「你可以施放法術，任何直視其閃爍光芒的人會被暫時致盲而無法行動。」
"Never met her. I only built this vacation home here a century ago."	「沒見過。我只是一百年前在這裡蓋了個度假屋。」
"Erana has a nice little magical meadow in her name northwest of here. Pretty respectable Spellcaster, I imagine." 	「伊瑞娜在西北方有個以她名字命名的漂亮小魔法草地。我想她是個相當令人尊敬的法師。」
"The protection spell she cast over the town is fairly good, but I believe she missed a few places."	「她對城鎮施放的保護法術相當不錯，不過我認為她遺漏了幾個地方。」
"You're just jealous because the only thing anyone named after you was a soft drink."	「你只是嫉妒，因為以你名字命名的唯一東西是飲料。」
"I thought that "Erasmus's Razzle Dazzle Root Beer" was a WONDERFUL name for a product.  It's a shame the company went broke afterwards." 	「我覺得『伊拉斯謨的眩目術根啤酒』是個很棒的產品名稱。可惜公司後來倒閉了。」
"I am a wizard of some reknown."	「我是個頗負盛名的法師。」
"What am I, some sort of object?  Am I invisible or something that you talk about me behind my back in front of my face?  Sheesh, no respect." 	「我是什麼，某種物品嗎？我隱形還是什麼，你居然在我面前背後說我？唉呀，真沒尊重。」
"It's hard to take anyone very seriously who wears such a ridiculous hat."	「很難認真對待戴著這麼荒唐帽子的人。」
"'Fetch' is a useful spell for catching and retrieving small objects." 	「『取物術』是個用來抓取和取回小物件的實用法術。」
"Good for putting things in their place."	「很適合把東西放在其位置。」
"Like uppity familiars?"	「像那傲慢的熟悉者？」
"I'd put you in your place, but I'm above such things."	「我會把你放在位置上，但我自居於此等之上。」
"Besides, my place is above your reach."	「再者，我的位置在你無法及之處。」
"Henry is a hermit who lives by the Flying Falls to the south.  Great sense of humor." 	「亨利是個隱士，住在南邊飛瀑附近。幽默感十足。」
"That means he actually laughs at Erasmus's jokes." 	「那表示他真的會笑伊拉斯謨的笑話。」
"I think he borrowed something the last time I saw him, but I can't remember exactly what it was."	「我想他上次見面時借了什麼東西，但我記不清確切是什麼。」
"Oh, well, Henry is a great one to talk to."	「噢，嗯，亨利是個很好談的人。」
"But 'e 'ardly ever 'appens to 'ave much to say."	「但他幾乎從不多說。」
"You need to complete your quest here before you can become initiated as a Wizard."	「你必須先完成此地的任務，才能成為法師。」
"If Magic be the lute of life, play on!"	「如果魔法是生命的琴弦，那就奏響吧！」
"The quote was "Music", not "Magic"!  And it was "food", not "lute"." 	「引文是『音樂』，不是『魔法』！而且是『食物』，不是『琴弦』。」
"How about:  "Magic makes the world go 'round"?" 	「怎麼樣：『魔法讓世界轉動』？」
"MONEY makes the world go 'round!"	「金錢讓世界轉動！」
"Oh!"	「噢！」
"Very well, then.  To put it in my own words:  "Magic is the essence and the soul of life, and the Wizard is her poet"." 	「好吧。用我自己的話說：『魔法是生命的本質與靈魂，法師是它的詩人』。」
"Actually, it was Merlin who said that first, but he used the term "Magician", not "Wizard"."	「實際上，那是梅林先說的，但他用的是『魔術師』，不是『法師』。」
"Fenrus, there are times when you would look better as a newt!"	「芬魯斯，有時候你做隻蠑螈會更好看！」
"Why is that?"	「為什麼？」
"Because newts can't talk!"	「因為蠑螈不會說話！」
"Neither can most rats."	「大多數老鼠也不會。」
"Just a little something to challenge the mind and magic with that I like to play every now and again.  Fenrus isn't much of a challenge any more." 	「只是我不時喜歡玩的挑戰心智和魔法的小遊戲。芬魯斯已經不太能挑戰我了。」
"That's because I always win."	「那是因為我總是贏。」
"I still think you're cheating somehow!"	「我還是覺得你在作弊！」
"Anyway, the game involves casting four spells:  'Flame Dart', 'Open', 'Fetch', and 'Trigger'." 	「不管怎樣，遊戲涉及施放四個法術：『火焰鏢』、『開啟術』、『取物術』和『觸發術』。」
"And to make it worth your while, if you beat me, I'll teach you a new spell called 'Dazzle'."	「為了讓你有所收穫，如果你打敗我，我會教你一個叫『眩目術』的新法術。」
"There are many types of magic mirrors.  One of the more common types is the one that has a strange face popping up every so often."	「有很多種魔法鏡。較常見的一種是時不時會冒出奇怪臉孔的那種。」
"Reminds me of the one in the master bedroom."	「讓我想起主臥室裡的那個。」
"That's not magical."	「那不是魔法。」
"No, but it does have a strange face peering from it whenever you are in the room."	「不，但當你在房間裡時，總有個奇怪的臉從裡面往外看。」
"At any rate, I used to have a nice magic hand mirror I misplaced around here somewhere.  It could be used to reflect a spell back upon the caster." 	「不管怎樣，我以前有個漂亮的魔法手鏡，不知怎地在這附近弄丟了。它可以用來將法術反彈回施咒者身上。」
"So, if you happen upon a small golden magic mirror with a dragon handle on it, you'll know it's mine."	「所以，如果你碰巧發現一面有龍把手的小金色魔法鏡，就知道是我的。」
"It was the flagon with the dragon.  The mirror had a leer."	「那是有龍的酒瓶。鏡子有個譎笑。」
"Oh, that's right."	「噢，沒錯。」
"Well, if you find a magic mirror with a face on it, you'll know it reflects spells."	「嗯，如果你找到一面有臉的魔法鏡，就會知道它能反射法術。」
"Isn't that the Vampire who fell in love with throats?"	「那不是愛上喉嚨的吸血鬼嗎？」
"No, no! That's a 'neck romancer'!"	「不，不！那是『頸戀者』！」
"A necromancer is a magic user who has a rather unsavory relationship with corpses."	「死靈法師是與屍體有著相當不適關係的魔法使用者。」
"Does that mean a necromancer has ghoul friends?"	「那表示死靈法師有鬼怪朋友嗎？」
"It means a necromancer is someone who deals with the undead."	「它表示死靈法師是處理不死生物的人。」
"Canasta with cadavers and Spades with shades, eh?"	「跟屍體玩卡納斯塔，跟幽靈玩黑桃，哈？」
"He laughs too much when he casts his spells."	「他施法時笑得太多了。」
"That's because his jokes are funnier than yours."	「那是因為他的笑話比你的好笑。」
"That spell lets you open things, with a mere gesture."	「那個法術讓你只需一個姿勢就能打開東西。」
"If you're really good at it, you can open locks.  Useful when you lose your keys." 	「如果你真的很擅長，你可以打開鎖。當你丟失鑰匙時很有用。」
"Your keys are in the study under the skull."	「你的鑰匙在書房骷髏下面。」
"Why would they be there?"	「為什麼會在那裡？」
"They're skeleton keys, aren't they?"	「那些是骨頭鑰匙，不是嗎？」
"Looks to me as if she missed the back part of the alley, and the spell only applies to areas in town above the ground.  Pretty shoddy, if you ask me!" 	「在我看來，她遺漏了巷子的後半部分，法術只適用於城鎮地面以上的區域。如果你問我，相當馬虎！」
"Nobody asked you."	「沒人問你。」
"Erana's spell prevents the use of excessive violence or hostile magic within Spielburg's walls, with the exception of a couple of places."	「伊瑞娜的法術在史畢柏格的城牆內防止過度暴力或敵意魔法的使用，除了幾個地方。」
"It's important for a magic user to know as many spells as possible. You never know just what might come in handy."	「魔法使用者知道盡可能多的法術是很重要的。你永遠不知道什麼派上用場。」
"Magical traps are a good way to keep thieves out of your chests and other places."	「魔法陷阱是把小偷擋在箱子和其他地方外的好方法。」
"Put a fire trap on a chest and when someone goes to open it, he goes up in smoke."	「在箱子上設置火焰陷阱，當有人試著打開它時，他就化為煙霧。」
"Just so long as you don't forget about it and try to open the chest yourself."	「只要你別忘了它，自己試著打開箱子就好。」
"I only got a little singed the last time." 	「上次我只是稍微被燒焦了。」
"Trigger is used to set off an existing spell."	「觸發術用來激發現有的法術。」
"If a chest has a magical trap on it, you can set the trap off by casting a 'Trigger' spell." 	「如果箱子上有魔法陷阱，你可以施放『觸發術』來激發陷阱。」
"Just make sure you're out of range of the trap."	「只要確保你在陷阱範圍外。」
"I can set up other spells and let someone else 'Trigger' them."	「我可以設置其他法術，讓別人『觸發』它們。」
"I fixed Henry the Hermit's cave for him so that he can do a lot of magic with only one spell."	「我為隱士亨利修理他的洞穴，這樣他只需一個法術就能進行大量魔法。」
"The only thing I've seen the brigand warlock cast is sneezing powder."	「我見過山賊術士施放的唯一東西是打噴嚏粉。」
"Zara has a real flair for the theatric.  Her entrance at the magic shop is a bit showy but effective." 	「札拉真的很有戲劇天份。她在魔法店的出場有點浮誇但很有效。」
"It's a pity she has no sense of humor."	「可惜她沒有幽默感。」
"Just because she doesn't laugh at your jokes doesn't mean that she lacks a sense of humor."	「只因為她不笑你的笑話不表示她沒有幽默感。」
"It just means that she has good taste."	「它只表示她品味不錯。」
Behind the wizard's stern and forbidding appearance you see a twinkle in his eye.  You suspect that he is not always as serious as he appears. 	在巫師嚴肅而令人敬畏的外表背後，你看到他眼中的一絲閃光。你懷疑他並不總是看起來那麼認真。
Brigands	山賊
Spellcasters	法師
Countercurses	反詛咒
Curses	詛咒
Dazzle	眩目術
Fetch	取物術
Hermit	隱士
Initiation	入門
Magic	魔法
Mage's Maze	法師迷宮
Magic Mirror	魔法鏡
Necromancer	死靈法師
Nincompoop	笨蛋
Open	開啟術
Places	地點
Protection Spell	保護法術
Spells	法術
Trap	陷阱
Trigger	觸發術
Warlock	術士
"It's that rat mat (or maybe a mouse pad)."	「那是鼠墊（或者也許是滑鼠墊）。」
"Erasmus is my Familiar."	「伊拉斯謨是我的熟悉者。」
"Isn't that the other way around?"	「那不是相反嗎？」
"Familiar is my Erasmus?  Well, I've always found Erasmus to be overly familiar...." 	「熟悉者是我的伊拉斯謨？嗯，我一直認為伊拉斯謨過於親近…」
"No, no.  I mean, aren't you MY Familiar?" 	「不，不。我是說，你不是我的熟悉者嗎？」
"Tsk, tsk.  All these years and you still don't know." 	「啧啧。這麼多年了你還是不知道。」
"What's there to say.  For a rat, I'm a really great guy." 	「有什麼好說的。作為老鼠，我真的是個好人。」
"Although for such a great guy, you're really a rat." 	「雖然你是個那麼好的傢伙，但你真的是隻老鼠。」
Fenrus looks back at you with a grin. 	芬魯斯咧嘴回頭看著你。
These stones are the base of the tower spire. 	這些石頭是塔尖的基座。
Yes!  It's the columnation of your adventures thus far (Ionic, isn't it?). 	是！這是你迄今冒險的柱式結構（愛奧尼亞式的，不是嗎？）。
This stone is the base of the tower spire. 	這塊石頭是塔尖的基座。
Yes. 	是。
No.	不。
"I do so enjoy playing the Mage's Maze."	「我真的很喜歡玩法師迷宮。」
"Come in and sit down."	「進來坐下。」
"Fenrus, our guest has arrived."	「芬魯斯，我們的客人到了。」
"Cheese, please!"	「起司，拜託！」
