"I also buy spell components if you are interested in gathering some for me. Don't mind me, I always have so much to do around here."	「我也收購法術材料，有興趣幫我採集的話儘管說。別理我，我這兒事情多得很。」
You see a clean but very cluttered little hut filled with bottles and potions.  The Healer is busy puttering around with her potions.	你看見一間乾淨但凌亂不堪的小屋，擺滿了瓶瓶罐罐和各式藥水。治療師正忙著在她的藥水堆裡翻騰。
There is a small flying creature preening itself on the rafter.  A ladder leads to the loft above.  A pot over the fire simmers with herbs.  It is pleasantly warm in here.	一隻小飛行生物在梁上理羽毛。一把梯子通向上面的閣樓。火上的鍋子裡飄著草藥香。這兒溫暖舒服極了。
You can buy potions, get information, or sell ingredients here.	你可以在這裡買藥水、打聽消息，或賣材料。
There is an aura of magic throughout this small cabin.	整間小屋籠罩著魔法氣息。
"Come back in the morning, please."	「請早上再來。」
You don't really think that is the correct way to win this game, do you? 	你不會真的認為那是贏遊戲的正確方法吧？
You see bottles and flasks of a wide variety of different potions.	你看見各式各樣的瓶子和燒瓶裡裝著五花八門的藥水。
You carefully grab a couple of Healing Potions and conceal them under your cape.	你小心翼翼地抓起幾瓶治療藥水，藏在你的披風下。
If you're going to steal, at least wait until the Healer is not looking.	你要偷的話，至少等治療師不看的時候。
You're getting greedy.  She'll notice if you take any more.	你貪心了。你再拿她就會發現的。
The healer uses this table as a workbench. 	治療師把這張桌子當成工作台。
You see a few odds and ends (not to mention This and That). 	你看見各式各樣的東西（更別提那些雜七雜八的）。
The view from the window has been obscured by soot from the fire.	窗戶外的景色被爐火的煙灰遮住了。
It's snow. 	那是雪。
The cave looks very eerie and ominous.	洞穴看起來陰森詭異。
Better watch out -- those icicles look sharp!	小心點──那些冰錐看起來很尖銳！
Although the cave mouth looks like a mouth, and opens and shuts like a mouth, I'm afraid it doesn't know how to talk like a mouth.	雖然洞口看起來像嘴巴，開閉起來也像嘴巴，但我怕它不知道怎麼像嘴巴那樣說話。
From the blue color of his skin and his huge height, you can tell this is a Frost Giant.	從他皮膚的藍色和巨大的身軀，你能看出這是個暴風巨人。
The gem glows like an aurora in the night sky.	那顆寶石像夜空的極光一樣閃耀。
The Giant looks at you in disgust.  Apparently, you did not offer what he desires. 	巨人厭惡地看著你。看來你沒給他想要的東西。
Bargain	討價還價
Brauggi	布勞基
Hunger	飢餓
Mead	蜂蜜酒
Northlands	北國
"Find me some fruit for to mellow my mead horn, Gift I will give of a gem that now glows --"	「給我找點水果來緩和我的蜂蜜酒啊，我會賞你這顆會發光的寶石──」
"Jewel from Jotunheim, flare of the frost flame, Fetch to me fruit that will fill up my fists!"     	「約頓海姆的寶石啊，冰焰的光芒，給我拿來滿滿一拳頭的水果！」
(It looks like it will take a lot of fruit to fill up THOSE fists!)  	（要填滿那樣的拳頭看來得花不少水果啊！）
"Brauggi I be, to boast of my boldness, Strong as the storm that sends forth the snow."  	「我就是布勞基，以膽識自豪，強似送來白雪的風暴。」
"Fiercer in fighting than foes in their fury, Fear now this Frost Giant fighter and flee!"  	「戰鬥中比敵人猛，所向披靡，怕我這暴風巨人戰士吧，逃吧！」
"Fiercer than frost's bite, my fury is fearless, My axe it is edged as is the ice."	「比寒冰的咬傷更兇悍，我的怒火無畏，我的斧刃如同冰鎚。」
"This warrior is willing to wield now the war drum, The battleaxe blazes and bellows for blood."   	「這戰士如今願意揮舞戰鼓，戰斧熊熊燃燒，呼號著要血！」
"Highpoint of harvest, the finest of flavor, Apples or oranges, peaches or pears."  	「豐收的高峰，最上乘的滋味，蘋果或柳橙，桃子或梨子。」
"Glow of the frost flame that fills up the night field, A jewel that is flawless, the finest of gems."  	「充滿夜空的冰焰光芒，無瑕的寶石，最精美的珍珠。」
"Hollow my food house, for my hunt has been hindered, By having to hurry here from my home."  	「我的食物倉空了啊，因為狩獵受阻，得匆匆從家趕來這裡。」
"Mead is the mother's milk, mighty yet mellow That brings joy to Giants and madness to men."  	「蜂蜜酒是母親的奶啊，強大卻溫和，給巨人帶來歡樂，給人類帶來瘋狂。」
"Far from the frost field, fares forth this fighter, Hunger has hurled me hither from home." 	「遠離冰雪地啊，這戰士踏上征途，飢荒把我從家鄉硬生生扔到這裡。」
"My name it is known in the Northlands as Brauggi, Barter with blade's clash, or bargain with me."     	「北國都知道我叫布勞基，用刀劍碰撞來交易，或者跟我討價還價。」
The log is covered with a layer of late winter snow.	原木被厚厚的晚冬積雪覆蓋著。
Leave it alone; you don't know where that log's been. 	別碰它；你不知道那根木頭哪來的。
I'm sure that was fun; why don't you talk to a twig next? 	我敢說那很有趣；下一個何不去跟樹枝說話？
You can see a small patch of sky through the trees.	你能透過樹木看到一小片天空。
That's it; reach for the sky!	就是那樣；夠著天空吧！
It's a bit late in the season for skiing.	這季節滑雪有點晚了。
Maybe if you reach those mountains, you'll become a true hero. 	或許如果你登上那些山峰，你就會成為真正的英雄。
I don't think talking to a mountain is healthy. 	我不覺得跟山說話是健康的舉動。
"Fruit you have found, to fill all my food stores, Thus filled the bargain, my gem you have bought."  	「果實你找到了，填飽了我的食物倉，交易這樣成了，寶石就是你的。」
"Brauggi has bartered, and all has been answered; The mead it may mellow, and now I head home."     	「布勞基完成交易了，一切都成了；蜂蜜酒能讓我舒坦，如今我要回家了。」
"Courage you carry,  but skill it is scanty; Face not this foe  before fiercer you fight."   	「你有膽量啊，但技巧還差得遠；別跟我這敵手交手，除非你變得更兇悍。」
Brauggi strides off through the cave on his way back to his Northern home.	布勞基大步踏過洞穴，踏上回北國家園的征途。
Your fruit definitely makes a generous pile in the Giant's cupped hands, but they're not full yet.	你的水果在巨人的雙手窩裡堆成不錯的一堆，但還沒滿。
Running on the ice is apparently not a very good idea.	在冰上跑看起來不是什麼好主意。
As you begin to cast your spell...	當你開始施法時…
Oops.  You're not carrying any fruit for the Frost Giant.   	哎呀。你身上沒有暴風巨人要的水果。
Your meagre selection of fruit makes a paltry pile at the bottom of the Giant's cupped hands.  You'll need to get quite a few more apples to fill THOSE hands!	你那可憐兮兮的水果在巨人雙手窩底堆成一小堆。你得多拿好幾個蘋果才能填滿那樣的手！
As you start to throw...	當你開始投擲時…
The mountains rise quickly from this point and are covered with snow.  To the west, you can see that the snow has melted in most of the forest, but here it is still heavy. 	山峰從此處陡峭上升並覆滿白雪。往西看，你能看到森林大部分的雪已融化，但這邊的雪還厚著呢。
Brauggi has departed on the long journey to his homeland.	布勞基已踏上返回家鄉的漫長征途。
Brauggi has become impatient with your questions and gone elsewhere.  You will have to return another time. 	布勞基對你的問題不耐煩了，去別的地方了。你得改天再來。
The Giant (who does not seem pleased at your casting a spell in his presence) radiates a magical aura.  The strongest magic centers on the glowing gem at his belt.	巨人（看起來對你在他面前施法不太高興）散發著魔法氣息。最強的魔法聚集在他腰上那顆會發光的寶石上。
The blue in the sky is just like the blue sky of your home.  You feel a sudden pang of homesickness, and begin to understand Brauggi's loneliness.	天空的藍色就像你家鄉的藍天。你突然湧起鄉愁，開始理解布勞基的孤寂。
To touch the sky, what dreams you have! 	想觸摸天空，你的夢想好遠啊！
Snow covers rock, scissors cut snow, and rock breaks scissors.  It's very Zen. 	雪蓋住石頭，剪刀剪碎雪，石頭砸爛剪刀。很禪嘛。
Before you take that snow and put it in your mouth, ask yourself a question: "Do I feel lucky?" 	在你把那雪拿進嘴裡之前，問問自己一個問題：「我感覺幸運嗎？」
The rock seems to listen patiently, but doesn't respond.	石頭好像在耐心傾聽，但沒有回應。
Snow covers these rocks like a blanket. 	雪像毯子一樣覆蓋著這些石頭。
It would be fun to make a snowball, but you really haven't time.	堆雪球是很有趣，但你真的沒時間。
There's snow all around this area.  In fact, it seems rather colder here than in the rest of the valley.	這地方四周都是雪。事實上，這兒看起來比山谷其他地方冷得多。
It would be fun to make a snowball, but you really haven't time. 	堆雪球是很有趣，但你真的沒時間。
It's a small patch of yellow snow. 	那是一小片黃雪。
The last thing you need is a yellow snowball. 	你最不需要的就是黃雪球。
You look at the apple cores, and quickly decide they are of no use to you. Besides, they look disgusting.	你看著蘋果核，迅速決定它們對你沒用。而且它們看起來噁心得要死。
The baby Meep is just too quick for you.  Besides, they eat too much.	小咪普快得你根本追不上。而且它們食量太大了。
The baby Meep sure is cute.	小咪普真的很可愛。
You keep seeing differently-colored Meeps come out of each hole.  They either lead to large underground caverns, or they are all connected under the earth.	你不斷看見不同顏色的咪普從每個洞冒出來。它們要嘛通向大型地下洞穴，要嘛全部在地底連通。
There is a wad of bright green fur on the ground.	地上有一團亮綠色的毛皮。
The meadow is covered with a light carpet of grass, broken up by the Meep holes. 	草地被薄薄的草皮覆蓋著，中間散佈著咪普的洞。
"Hey, like, we eat them, you know."	「嘿，咦，我們吃它們啊，你知道吧。」
"Cute, huh?  The tunnels down here just crawl with those things.  Get in the way all the time, you know?"	「可愛吧？底下的隧道裡到處都是那些傢伙。老是擋路，你知道吧？」
"Gee boss, I really don't know much about that at all.  Hey, sorry."	「天啊老大，我對那個真的不太了解。嘿，抱歉。」
"Gee boss, I really don't know much about that at all.  Hey, sorry." 	「天啊老大，我對那個真的不太了解。嘿，抱歉。」
"Hey, like fur is good stuff, keeps us warm.  Mine's the best -- it's like green, you know?"	「嘿，咦，毛皮是好東西啊，能讓我們暖和。我的最讚──是綠色的，你知道吧？」
"Oh, you want some green fur?  I think I have some somewhere."	「哦，你想要綠毛皮？我想我某個地方放著呢。」
"We, like, live in tunnels under the ground, you know."	「咦，我們住在地底的隧道裡，你知道吧。」
"I found a scroll lying around in the woods one day.  You want it?  It's yours." 	「我有天在樹林裡找到一卷捲軸。你想要？它就是你的。」
"We are happy Meeps, living in our happy holes.  Don't worry.  Be happy!"  	「我們是快樂的咪普，住在我們快樂的洞裡。別擔心。要開心！」
"We use rocks for doors.  They keep us dry and warm in our holes."	「我們用石頭當門。它們讓我們的洞裡乾爽又暖和。」
"That thing?  I found it lying around in the woods one day.  You want it? It's yours."	「那東西？我有天在樹林裡找到的。你想要嗎？它就是你的。」
The Meep scrambles back into its hole as you try to touch it. 	當你試著碰咪普時，它匆匆鑽回洞裡。
You realize that you have never seen more than one green Meep at a time. Perhaps there is only one.	你意識到你從沒同時見過一隻以上的綠咪普。或許只有一隻。
There seems to be an abundant supply of blue and purple Meeps.  If only they'd stay still for a moment, you'd be able to count them.  	看起來有大量的藍咪普和紫咪普。要是它們肯靜一下，你就能數清楚了。
The Meeps have brightly-colored, soft-looking fur. 	咪普長著色彩繽紛、軟呼呼的毛皮。
Apples	蘋果
Baby	寶寶
"Hey, just ask me about anything you want to know." 	「嘿，有什麼你想知道的儘管問我。」
Fur	毛皮
Holes	洞穴
Meeps	咪普
Rocks	石頭
Scroll	捲軸
You hear squeaky muttering from beneath the ground.  It seems the Meeps are having quite a discussion about you.	你聽見地底傳來吱吱嘎嘎的碎碎念。看來咪普們正在熱烈討論你呢。
You don't need to do that.	你不需要那樣做。
You walk away from the hole to get out of the rock's way.	你走開了，讓開那塊石頭。
You pick up the green fur. 	你撿起綠毛皮。
The magical runes fade from the paper before your eyes can focus on them.	魔法符文在你的眼睛聚焦之前就從紙上褪去了。
You pick up the Spell Scroll.  As the magical runes fade, you find you now know how to cast the "Detect Magic" spell.	你撿起魔法捲軸。當符文褪去時，你發現自己現在知道怎麼施展「偵測魔法」法術了。
"Hiya, hiya. Nice to seeya 'gain."	「嘿啊，嘿啊。很高興又見到你。」
"Hiya, hiya.  Pleased to meetcha." 	「嘿啊，嘿啊。很高興認識你。」
Hearing a rumble from the Meep hole, you quickly slip out of the way.	聽見咪普洞裡傳來隆隆聲，你迅速閃到一邊。
You detect no other magic here.	你在這裡沒有偵測到其他魔法。
All of the Meeps are hiding deep within their holes.  Your vicious attack has them terrified.	所有咪普都躲在洞裡深處。你的凶悍攻擊嚇得它們要死。
You see blue Meeps, purple Meeps, and occasionally a green Meep.  They seem to be very shy; whenever you approach one, it hides under its rock.	你看見藍咪普、紫咪普，偶爾還有綠咪普。它們看起來超害羞；你一靠近，它就躲到石頭底下。
You are in the Meeps' Peep.  The colorful, furry Meeps timidly pop out of their holes from time to time.	你在咪普的窩裡。色彩繽紛、毛茸茸的咪普們不時膽小地冒出洞口。
The Open spell only works on locks and small closed things.	「開啟術」只對鎖和小型密閉物品有效。
You can't talk to any of the Meeps. They are all hiding deep within their holes, terrified after your vicious attack.	你沒辦法跟任何咪普說話。它們都躲在洞裡深處，被你的凶悍攻擊嚇得要死。
The mountains are very steep here.	這邊的山峰陡得要命。
Large, heavy-looking rocks cover the many holes.  The Meeps must be stronger than they look to lift these rocks so easily.	大塊沉重的石頭蓋著許多洞。咪普們要夠強悍才能這麼輕鬆搬起這些石頭。
No way!  Those Meeps are too fast and the rocks too hard for you to want to try that again!	沒門！那些咪普太快、石頭太硬了，你不會想再試一次！
It looks like a Spell Scroll.	看起來像一卷魔法捲軸。
The trees and bushes look much like those you've seen elsewhere in the valley. 	樹木和灌木看起來跟你在山谷其他地方見過的很像。
"I just flew in from the coast and BOY! are my arms tired." 	「我剛從海邊飛過來，哇，我的手臂累死了。」
"Let us spin, then, you and I, when the evening is buried beneath the sky." It must be Tease Eliot, the ghost poet! 	「那麼讓我們旋轉吧，你和我，當傍晚埋沒在天空底下時。」准是逗趣·埃利奧特，那個幽靈詩人！
The lady is lovely as she lofts along, but beware her fatal touch!	那位女士飄然而過時美麗動人，但當心她致命的觸碰！
The large stone you are facing has been engraved with this message:	你面前的這塊大石頭上刻著這樣的訊息：
"Here lies Lester Moore Gored six times by a wild boar." 	「此墓：萊斯特·摩爾，被野豬戳傷六次。」
"No Les, no Moore." 	「沒有萊斯，沒有摩爾。」
The grate is clearly rusted shut.  You won't be able to open it.	那鐵柵欄明顯生鏽卡死了。你沒辦法打開。
A massive grate covers a hole, keeping you from seeing the bottom. 	一扇巨大的鐵柵欄蓋著一個洞，擋住你的視線不讓你看底下。
The large tombstone seems to have a barely legible epitaph:	那塊大墓碑上的墓誌銘看起來幾乎無法辨認：
