"Thus will you become a true friend of the forest."	「這樣你就會成為森林的真正朋友。」
You pick up the Dryad's gift of a Magic Acorn.	你拿起樹精贈與的魔法橡實。
You drop the seed into the Dryad's limbs.	你把種子掉進樹精的枝幹中。
"Until you have done so, you are only intruding on my concentration."	「在你完成之前,你只是在打擾我的冥想。」
That acorn tasted awfully bitter... just like an ordinary acorn. 	那顆橡實嚐起來苦得要命…就像一顆普通的橡實。
You find an ordinary acorn on the ground.  	你在地上找到一顆普通的橡實。
"You dare to harm the Dryad of the forest!  You must be made less dangerous." 	「你竟敢傷害森林的樹精!你必須變得不那麼危險。」
"Heed now my words, friend of the forest, and heed them well."	「現在就要聽我的話,森林的朋友,要聽清楚。」
"Friend, you must know that there is an evil in this valley which perverts the ways of nature.  The prophecy says that a hero will bring a young human from out of this darkness."	「朋友,你必須知道這個山谷裡有一股邪惡之力,它扭曲了自然的秩序。預言說會有一位英雄將一個年輕的人類從黑暗中拯救出來。」
"If you are the one to accomplish this task, there is a potion to break enchantments which the Healer can make for you." 	「如果你能完成這項任務,治療師可以為你製作一個解除魔法的藥水。」
"You must gather these ingredients:"	「你必須收集這些材料:」
"Flowers from Erana's Peace,"	「伊瑞娜的安寧之地的花朵,」
"Green Fur,"	「綠色的毛皮,」
"Fairy Dust,"	「妖精之塵,」
"a Magic Acorn,"	「一個魔法橡實,」
"and Flying Water."	「和飛行之水。」
"Farewell, friend.  I must return to my concentration.  May the forest forever surround you."	「再見了,朋友。我必須回去冥想。願森林永遠環繞著你。」
You follow the stag into this forest corner.  You feel as though the eyes of the forest are watching you.	你跟著白鹿進入森林的角落。你感覺彷彿整個森林的眼睛都在注視著你。
What a beautiful animal!	多麼美麗的動物!
"You need to become a friend of the forest.  Harm not the gentle creatures or plants.  See with all your senses the magic of the trees and wild places." 	「你需要成為森林的朋友。不要傷害溫和的生物或植物。用你所有的感官去感受樹木和野生地方的魔法。」
"Wander and learn.  Then you too will be in harmony with the forest."	「漫步其中吧,並學習。然後你也會與森林和諧相處。」
"Give the seed to me."	「把種子給我。」
"Now this will boldly grow where none has grown before!"	「現在它將大膽地在無人種植過的地方生長!」
"You have destroyed the plant that was to be preserved!"	「你摧毀了本應被保護的植物!」
"As you have destroyed, so shall you now become!"	「正如你所摧毀的,你現在也將變成這樣!」
"You have attempted to harm a free creature of the forest!"	「你試圖傷害森林的自由生物!」
"You shall now become a part of the forest!"	「你現在將成為森林的一部分!」
"You have misused your skills, oh Magician!  You have used the Flame Dart on my forest."	「你濫用了你的技能,哦,法師!你在我的森林上使用了火焰鏢。」
"You must be made less dangerous."	「你必須變得不那麼危險。」
You are forced to confess that you lied to the Dryad.  You don't have the magic seed.	你被迫承認你對樹精撒謊了。你沒有魔法種子。
"It's not nice to fool Mother Nature."	「欺騙大自然是不禮貌的。」
You tell the Dryad: "No amount of persuasion could convince the flowers to relinquish their seed easily, so I was forced to hack my way to the seed with my weapon." 	你告訴樹精:「無論多少勸說都無法輕易說服花朵放棄它們的種子,所以我被迫用武器砍出一條路到達種子。」
You pick it up and eat it.	你拿起它並吃了它。
The acorn appears too ordinary.  You drop it back on the ground.	那顆橡實看起來太普通了。你把它掉回地上。
"I detect that you have in your possession such a seed.  Are you willing to give me the seed?"	「我發現你擁有這樣一顆種子。你願意把種子給我嗎?」
"Have you brought the seed I requested?"	「你帶來我要求的種子了嗎?」
"Well, Hero-to-be!  Are you yet a friend of the woods?"	「好吧,未來的英雄!你是森林的朋友嗎?」
The tree-woman speaks:  "I am the Dryad, keeper of the woods.  Are you one with the woods?"	樹精女人說:「我是樹精,森林的守護者。你與森林為一體嗎?」
Again, you feel a sense of closeness with nature.	你再次感到與自然相近的感覺。
You know you will sleep comfortably and well in this quiet and protected corner of the woods. 	你知道在森林的這個安靜而受保護的角落,你會舒服地安睡。
The stag is startled by your action.	白鹿被你的行動嚇到了。
You watch the stag, fascinated with his grace and beauty.  There is something special about this place.	你看著白鹿,被它的優雅和美麗迷住了。這個地方有什麼特別的。
The oak tree radiates magic.	橡樹散發出魔法。
The Dryad radiates magic.	樹精散發出魔法。
You can feel a gentle breeze wafting its way between the woods.  The scent of fresh flowers and green growing things fills you with a sense of peace.	你可以感覺到微風輕輕吹過森林。新鮮花朵和綠色植物的香氣充滿了你,讓你感到平靜。
You are in a strange and beautiful part of the forest.  There is something special about this place.	你在森林的一個奇異而美麗的地方。這個地方有什麼特別的。
The forest becomes so lush and thick to the west that it is difficult to see far.	森林向西變得非常茂密,很難看得遠。
The brush and undergrowth has formed an impassable thicket to the south.	灌木叢和下層植被在南邊形成了無法通過的灌木林。
You see thick brush, rocks, and heavy woods to the north.	你看到北邊有厚重的灌木叢、岩石和茂密的森林。
You sense a certain magic about the huge oak tree that dominates the clearing.	你感受到主宰空地的巨大橡樹散發的某種魔法。
That was interesting, but there's nothing here to open.	那是有趣的,但這裡沒有什麼可以打開的。
The rocks are much to heavy to move.	岩石太重了,無法移動。
The rocks to the north look steep.  There is a rock wall northeast of the large oak tree.	北邊的岩石看起來很陡峭。大橡樹的東北邊有一面岩壁。
Don't be ridiculous; you can't talk to a rock.  Try the trees instead. 	別傻了;你不能跟一塊岩石說話。試著跟樹說話吧。
The stag looks more surprised than injured. 	白鹿看起來更驚訝而不是受傷。
He's beyond your reach.	他超出你的範圍。
The majestic white stag is an outstanding example of the beauty of the animal kingdom.	莊嚴的白鹿是動物王國美麗的傑出典範。
You detect a strange, magical aura in this place.	你在這個地方察覺到奇異的魔法光環。
Your spell has no effect. 	你的魔法沒有效果。
Bushes solidly block your way south -- no shortcuts here.	灌木叢完全阻擋了你向南的路——這裡沒有捷徑。
You seem to have startled the white stag.	你似乎嚇到了白鹿。
The beautiful white stag is foraging for food. 	美麗的白鹿正在覓食。
The white stag takes a mighty leap. 	白鹿縱身一躍。
The stag looks more surprised than injured.  	白鹿看起來更驚訝而不是受傷。
You seem to have caused an Antwerp POPulation EXPLOSION! 	你似乎導致了一場安特衛普人口爆炸!
The bouncing baby Antwerps are all so cute, you can't bring yourself to interfere with their playing. 	跳動的小安特衛普都非常可愛,你無法阻止自己干預它們的遊戲。
Looking up, you can see a small, blue dot in the sky, getting bigger... and bigger... and BIGGER! 	向上看,你可以看到天空中一個小的藍點,越來越大…還有更大…還有更大!
Too late!	太晚了!
There's no time for that!	沒有時間做那個!
Your spell has no effect.	你的魔法沒有效果。
The beautiful white stag is foraging for food.	美麗的白鹿正在覓食。
The white stag takes a mighty leap.	白鹿縱身一躍。
The stag looks more surprised than injured.	白鹿看起來更驚訝而不是受傷。
Thick thorn bushes seal off the way south. 	厚重的荊棘灌木叢封住了南邊的路。
This man looks very tough.  From his clothing, you guess him to be a member of the Thieves' Guild.	這個人看起來非常硬漢。從他的衣著,你猜測他是盜賊公會的一員。
Like a floral alliance of the Mason-Dixon and Maginot lines, a row of bushes prevent you from moving south. 	就像梅森-迪克森線和馬其諾防線的花卉聯盟,一排灌木叢阻止了你向南移動。
The hollow log looks somberly back with it's single giant eye, and you know at once that nothing is to be gained by investigating this gaunt relic of a more vertical past. 	空心木頭用它唯一的巨大眼睛陰沉地看著,你立刻知道調查這個更垂直過去的瘦弱遺跡沒有任何收穫。
Besides that huge hollow log, there's nothing particularly special about this part of the forest (unless you count the sound of rushing water to the east). 	除了那個巨大的空心木頭,這部分森林沒有什麼特別的地方(除非你算上東邊湍急的水聲)。
The water seems to be trying to fly as it leaps from the mountain above.	水似乎在從上面的山上躍下時試圖飛起。
A river plunges for more than a hundred feet down the face of a cliff.  You see slick, vertical cliff walls.  A doorway has been built into the side of the cliff.	一條河流從懸崖面上垂直落下超過百英尺。你看到光滑的、垂直的懸崖牆。一扇門已經被建造在懸崖的一側。
The grass is green with the freshness of spring. 	草地是春天的新鮮的綠色。
The door is built into the face of the mountainside.  You suspect that the person who lives behind it treasures privacy.	門被建造在山邊的表面。你懷疑住在它後面的人珍視隱私。
It's a large door.  It must open pretty wide.	這是一扇大門。它一定開得相當寬。
It's a little hard to knock on the door from where you're standing.	從你站的地方敲門有點困難。
The door is so securely locked that it defies your abilities to unlock it. (You might have had an easier time if it had a keyhole.) 	門鎖得非常牢固,超出了你的解鎖能力。(如果它有鑰匙孔,你可能會容易得多。)
You can't do that from here.	你不能從這裡做那個。
You're too close to throw a rock.	你太近了,無法投擲岩石。
It's an iridescently shimmering magical ladder! 	這是一個虹彩閃爍的魔法梯子!
You don't see a ladder here.	你在這裡看不到梯子。
There is a narrow ledge in front of the wide door.	寬門前有一個狹窄的岩架。
You don't have an empty flask. 	你沒有空的瓶子。
The water gracefully flows towards Mirror Lake.	水優雅地流向鏡面湖。
You already have some.  Don't be greedy. 	你已經有一些了。不要貪心。
Your flask is already full of water. 	你的瓶子已經充滿了水。
The rocks are too slick from the spray of the waterfall for your limited climbing skill.	由於瀑布的噴霧,岩石太光滑了,超出了你有限的攀爬技能。
Flat... you feel very, very flat. 	扁…你感覺非常、非常扁。
"'ello?"  	「嘿?」
Wow!	哇!
Wheeee!	呼!
"You again?  Either come up, or go away.  I really doesn't cares which."  	「又是你?要麼上來,要麼滾開。我真的不在乎哪一個。」
You'll have to climb down if you want to get water. 	如果你想要水,你得爬下去。
The water comes from melting snow.  This early in the season, it's much too cold to swim.  Besides, you don't have a suit. 	水來自融化的雪。在這季節這麼早,游泳太冷了。而且,你沒有衣服。
"Oh.  'ello!    Go on in."  	「哦。嘿!進去吧。」
BOY!  You must have really been thirsty!	天哪!你一定真的很渴!
The roar of the waterfall fills your ears, and the cold spray dampens your face as you approach.	瀑布的轟鳴聲填滿了你的耳朵,當你靠近時,冷的噴霧潮濕了你的臉。
You fill an empty flask with crystal-clear water from the waterfall.	你用瀑布的清澈的水填滿了一個空的瓶子。
You look for a good place to climb.	你尋找一個好的攀爬地點。
"Mpfph..  grumble..  nobody 'ere, I guess."  	「嗯…抱怨…我想這裡沒人。」
"All right, already!"  	「好吧,已經!」
The rock makes a sharp sound as it hits the door.	岩石撞到門時發出尖銳的聲音。
RAP!	敲擊!
Man, that's a narrow ledge up there!	天啊,那是一個狹窄的岩架!
You knock three times.	你敲了三下。
A voice from inside says, "Just a minute!  Just a minute!" 	裡面傳來一個聲音:「稍等!稍等!」
"Please move away from the door."	「請遠離門。」
That was as easy... as climbing up a ladder. 	那像…爬梯子一樣容易。
That spell doesn't seem to work at this time.  	那個魔法在這個時候似乎不起作用。
"Is someone there?"  	「有人嗎?」
"Oh, 'ello.  Come right up."  	「哦,嘿。直接上來。」
"Just climb the ladder."  	「就爬梯子吧。」
You take another drink of water.  You were thirsty!	你又喝了一口水。你很渴!
That was almost too easy... just like climbing a ladder. 	那幾乎太容易了…就像爬梯子一樣。
Missed. 	射偏了。
You take a drink of water from the icy mountain river.  It refreshes you.	你從冰冷的山河喝了一口水。它使你恢復活力。
To the west, you see the forest.	向西,你看到森林。
The hermit doesn't seem to hear you.	隱士似乎沒有聽到你。
The only thing you can open here is the door, and you're not skilled enough to do that.	你唯一能在這裡打開的東西是門,而你沒有足夠的技能來做那個。
As you prepare your spell...	當你準備你的魔法…
The water is white as it splashes against the rocks with great force and purpose, and disappears into a narrow canyon to the south. 	水與岩石猛烈撞擊時變成白色,帶著巨大的力量和目的,然後消失在南邊的狹窄峽谷中。
It's the hermit's staff.  (He needs a large staff to help him record his memoirs for posterity.) 	這是隱士的杖。(他需要一個大杖來幫助他記錄他的回憶錄給後代。)
